English,"Harry S. Truman Scholarship Foundation",,Washington,"Contact the Harry S. Truman Scholarship Foundation
  https://www.truman.gov/about-us/contact-us",office@truman.gov,,,"Independent Board, Commission, Committee",DC,"712 Jackson Place, NW",,,1-202-395-4831,,,"Harry S. Truman Scholarship Foundation
  http://www.truman.gov/",20006,,,"The Harry S. Truman Scholarship Foundation provides scholarships to college juniors who demonstrate outstanding potential, and who plan to pursue a career in public service.",,Yes,On,"Tue, 02/27/2024 - 10:29
"
English,"Health Resources and Services Administration",HRSA,Rockville,"Contact the Health Resources and Services Administration
  https://www.hrsa.gov/about/contact/",,,"Find a health care center near you
  https://findahealthcenter.hrsa.gov","Executive Department Sub-Office/Agency/Bureau",MD,"5600 Fishers Lane",,,,,,"Health Resources and Services Administration
  https://www.hrsa.gov/",20857,,,"The Health Resources and Services Administration (HRSA) improves access to health care for people who are uninsured, isolated, or medically vulnerable.","<a href=""/es/agencias/administracion-de-recursos-y-servicios-de-salud"" hreflang=""es"">Administración de Recursos y Servicios de Salud</a>",Yes,On,"Tue, 02/27/2024 - 10:40
"
English,"Holocaust Memorial Museum",,Washington,"Contact the Holocaust Memorial Museum
  https://www.ushmm.org/information/connect-with-the-museum",,,,"Executive Department Sub-Office/Agency/Bureau",DC,"100 Raoul Wallenberg Place, SW",,,1-202-488-0400,,1-202-488-0406,"Holocaust Memorial Museum
  https://www.ushmm.org/",20024-2126,,,"A living memorial to the victims of the Holocaust, the Memorial Museum was built on donated federal land and is funded through private donations.",,Yes,On,"Wed, 03/15/2023 - 22:02
"
English,"House Office of Inspector General",OIG,Washington,"Contact the House Office of Inspector General
  https://www.uscp.gov/the-department/office-inspector-general",OIG@uscp.gov,,,Legislative,DC,"386 Ford Building",,,1-202-226-1250,,,"House Office of Inspector General
  https://www.house.gov/the-house-explained/officers-and-organizations/inspector-general",20515-9990,,,"The Office of Inspector General (OIG) conducts audits of the financial and administrative operations of the House of Representatives.",,Yes,On,"Tue, 02/27/2024 - 11:08
"
English,"House Office of the Clerk",,Washington,,info.clerkweb@mail.house.gov,,,Legislative,DC,"U.S. Capitol","Room H154",,1-202-225-7000,,,"House Office of the Clerk
  https://clerk.house.gov/",20515-6601,,,"The Office of the Clerk performs administrative functions for the U.S. House of Representatives, including creating and retaining the House Journal, calling new members to order, tracking questions of order, and managing the offices and staff of deceased or retired representatives.",,Yes,On,"Wed, 03/15/2023 - 22:02
"
English,"Human Foods Program",HFP,"College Park","Contact the Human Foods Program
  https://www.fda.gov/about-fda/human-foods-program/contact-human-foods-program-hfp",,,,"Executive Department Sub-Office/Agency/Bureau",MD,"Human Foods Program","U.S. Food and Drug Administration","5001 Campus Drive, HFS-009",1-888-723-3366,,,"Human Foods Program
  https://www.fda.gov/about-fda/fda-organization/human-foods-program",20740-3835,,,"The Human Foods Program oversees food safety and nutrition activities for the U.S. Food and Drug Administration. The program leads efforts to prevent foodborne illnesses, promote consumer health, and more.","<a href=""/es/agencias/programa-de-alimentos-para-consumo-humano"" hreflang=""es"">Programa de Alimentos para Consumo Humano</a>",Yes,On,"Wed, 08/06/2025 - 10:50
"
English,"Indian Arts and Crafts Board",IACB,Washington,"Contact the Indian Arts and Crafts Board
  https://www.doi.gov/iacb/who-we-are/contact",iacb@ios.doi.gov,,"Sioux Indian Museum
  https://www.doi.gov/iacb/our-museums/sioux, Museum of the Plains Indian
  https://www.doi.gov/iacb/museum-plains-indian, Southern Plains Indian Museum
  https://www.doi.gov/iacb/southern-plains-indian-museum, Indian Art Markets and Events
  https://www.doi.gov/iacb/indian-art-markets-and-events","Independent Board, Commission, Committee",DC,"1849 C St., NW","MS 2528-MIB",,,1-888-278-3253,,"Indian Arts and Crafts Board
  https://www.doi.gov/iacb/",20240,,,"The Indian Arts and Crafts Board (IACB) enforces the Indian Arts and Crafts Act of 1990 that prohibits false advertising in the marketing of Indian arts or crafts. The Board also provides certified Indian-owned business listings, provides federally recognized tribes with business assistance, and operates several Indian Arts and Crafts museums.",,Yes,On,"Tue, 02/27/2024 - 13:46
"
English,"Indian Health Service",IHS,Rockville,"Contact the Indian Health Service
  https://www.ihs.gov/contact/, Indian Health Service phone directory
  https://www.ihs.gov/Directory/",,,"Find an Indian Health Service facility near you
  https://www.ihs.gov/locations/","Executive Department Sub-Office/Agency/Bureau",MD,"5600 Fishers Lane",,,,,,"Indian Health Service
  http://www.ihs.gov/",20857,,,"The Indian Health Service (IHS) provides federal health services to American Indians and Alaska Natives.",,Yes,On,"Tue, 02/27/2024 - 13:53
"
English,"Indoor Air Quality",IAQ,Washington,"Contact the Indoor Air Quality Division
  https://www.epa.gov/indoor-air-quality-iaq/forms/contact-us-about-indoor-air-quality",,,,"Independent Agency",DC,"1200 Pennsylvania Avenue, NW","Mail Code 6609T",,,,,"Indoor Air Quality
  https://www.epa.gov/indoor-air-quality-iaq",20460,,,"The Indoor Air Quality Division (IAQ) is part of the U.S. Environmental Protection Agency and aims to raise public awareness of information related to indoor air quality.","<a href=""/es/agencias/division-de-calidad-del-aire-interior"" hreflang=""es"">División de Calidad del Aire Interior</a>",Yes,On,"Tue, 02/27/2024 - 14:18
"
English,"Institute of Education Sciences",IES,Washington,"Contact the Institute of Education Sciences
  https://ies.ed.gov/contact/",contact.ies@ed.gov,,,"Executive Department Sub-Office/Agency/Bureau",DC,"550 12th Street, SW",,,1-202-245-6940,,,"Institute of Education Sciences
  http://www.ed.gov/about/offices/list/ies/index.html",20024,,,"The Institute of Education Sciences (IES) provides rigorous evidence on which to base educational policy and practices.",,Yes,On,"Tue, 02/27/2024 - 14:43
"
English,"Institute of Museum and Library Services",IMLS,Washington,"Contact the Institute of Museum and Library Services
  https://www.imls.gov/about/contact",imlsinfo@imls.gov,,,"Independent Agency",DC,"955 L’Enfant Plaza North SW","Suite 4000",,1-202-653-4657,,,"Institute of Museum and Library Services
  https://www.imls.gov/",20024-2135,,,"The Institute of Museum and Library Services (IMLS) is a grant making organization that also conducts research and develops policy. The Institute helps libraries and museums innovate, fosters lifelong learning and cultural and civic engagement.",,Yes,On,"Wed, 02/28/2024 - 08:25
"
English,"Inter-American Foundation",IAF,Washington,"Contact the Inter-American Foundation
  https://www.iaf.gov/contact/",inquiries@iaf.gov,,,"Independent Agency",DC,"1331 Pennsylvania Ave., NW","Suite 1200",,1-202-360-4530,,,"Inter-American Foundation
  https://www.iaf.gov/",20004,,,"The Inter-American Foundation (IAF) provides grant support to Latin American and Caribbean grass-roots groups and non-governmental organizations with creative self-help ideas.","<a href=""/es/agencias/fundacion-interamericana"" hreflang=""es"">Fundación Interamericana</a>",Yes,On,"Wed, 02/28/2024 - 11:20
"
English,"Interagency Alternative Dispute Resolution Working Group",,Washington,"Contact the Interagency Alternative Dispute Resolution Working Group
  https://adr.gov/contact/",ADR@fmcs.gov,,,"Independent Board, Commission, Committee",DC,"Office of Conflict Management and Prevention","Federal Mediation and Conciliation Service","250 E. St. SW 7th Floor",,,,"Interagency Alternative Dispute Resolution Working Group
  https://adr.gov/",20427,,,"The Interagency Alternative Dispute Resolution Working Group helps federal agencies develop and implement Alternative Dispute Resolution programs.",,Yes,On,"Wed, 02/28/2024 - 11:26
"
English,"Interagency Committee for the Management of Noxious and Exotic Weeds",,,,,,,"Independent Board, Commission, Committee",,,,,,,,"Federal Interagency Committee for the Management of Noxious and Exotic Weeds
  https://www.invasivespeciesinfo.gov/ficmnew",,,,"With representatives from 16 federal agencies, this committee partners with the public and private organizations to identify and manage invasive plants in the U.S.",,Yes,On,"Wed, 03/15/2023 - 22:02
"
English,"Internal Revenue Service",IRS,,"Contact the IRS for help with your tax questions
  https://www.irs.gov/help/telephone-assistance",,,"Find a taxpayer assistance center near you
  https://www.irs.gov/help/contact-your-local-irs-office","Executive Department Sub-Office/Agency/Bureau",,,,,,1-800-829-1040,1-800-829-4059,"Internal Revenue Service 
  https://www.irs.gov, Taxpayer Advocacy Panel
  https://www.improveirs.org/",,,,"The Internal Revenue Service (IRS) administers and enforces U.S. federal tax laws.","<a href=""/es/agencias/servicio-de-impuestos-internos"" hreflang=""es"">Servicio de Impuestos Internos</a>",Yes,On,"Wed, 07/30/2025 - 07:54
"
English,"International Trade Administration",ITA,Washington,"Contact the International Trade Administration
  https://www.trade.gov/contact-us",,,,"Executive Department Sub-Office/Agency/Bureau",DC,"1401 Constitution Ave., NW",,,,,,"International Trade Administration 
  https://www.trade.gov/",20230,,,"The International Trade Administration (ITA) promotes U.S. exports by providing diplomatic support, helping to shape trade policy, removing trade barriers, and enforcing U.S. trade laws and agreements.",,Yes,On,"Thu, 02/29/2024 - 08:19
"
English,"James Madison Memorial Fellowship Foundation",,Alexandria,,info@jamesmadison.gov,,,"Independent Board, Commission, Committee",VA,"1613 Duke St.",,,1-571-858-4200,,,"James Madison Memorial Fellowship Foundation
  https://www.jamesmadison.gov/",22314,,,"The James Madison Memorial Fellowship Foundation offers fellowship opportunities to individuals who are seeking a Master&#039;s degree in order to teach secondary students about the U.S. Constitution.",,Yes,On,"Thu, 02/29/2024 - 10:38
"
English,"Japan-United States Friendship Commission",JUSFC,Washington,"Contact the Japan-United States Friendship Commission
  https://www.jusfc.gov/contact/",jusfc@jusfc.gov,,,"Independent Board, Commission, Committee",DC,"1201 15th St., NW","Suite 330",,1-202-653-9800,,,"Japan-United States Friendship Commission
  https://www.jusfc.gov/",20005,,,"The Japan-United States Friendship Commission (JUSFC) gives grants to stimulate engagement in business, educational, or cultural exchanges with Japan.",,Yes,On,"Thu, 02/29/2024 - 10:41
"
English,"Job Corps",,,"Contact Job Corps
  https://www.jobcorps.gov/contact",,,"Find a Job Corps campus near you
  https://www.jobcorps.gov/explore","Executive Department Sub-Office/Agency/Bureau",,,,,,"1-800-733-JOBS (1-800-733-5627)",1-877-889-5627,"Job Corps
  https://www.jobcorps.gov",,,,"Job Corps is a nationwide residential career training program that helps young people (ages 16 to 24) improve the quality of their lives through vocational and academic training. ",,Yes,On,"Thu, 02/29/2024 - 12:57
"
English,"John F. Kennedy Center for the Performing Arts",,Washington,"Contact the John F. Kennedy Center for the Performing Arts
  https://www.kennedy-center.org/contact/",,,,Quasi-official,DC,"2700 F St., NW",,,1-202-416-8000,1-800-444-1324,,"John F. Kennedy Center for the Performing Arts
  https://www.kennedy-center.org/, Today&#039;s free live stream from the Kennedy Center
  https://www.kennedy-center.org/digital-stage",20566,,,"The John F. Kennedy Center for the Performing Arts is a living memorial to President John F. Kennedy. The Center offers a wide range of performances, including frequent free or low-cost performances. The Center also runs a number of educational and outreach programs.",,Yes,On,"Thu, 02/29/2024 - 15:35
"
English,"Joint Board for the Enrollment of Actuaries",,Washington,"Contact the Joint Board for the Enrollment of Actuaries
  https://www.irs.gov/tax-professionals/enrolled-actuaries/how-to-contact-us",nhqjbea@irs.gov,,,"Executive Department Sub-Office/Agency/Bureau",DC,"SE:RPO, Room 3422","1111 Constitution Ave., NW",,,,,"Joint Board for the Enrollment of Actuaries
  https://www.irs.gov/tax-professionals/enrolled-actuaries/information-about-the-joint-board",20224,,,"The Joint Board for the Enrollment of Actuaries specifies the standards and qualifications an individual must meet in order to perform actuarial services.",,Yes,On,"Thu, 02/29/2024 - 15:45
"
English,"Joint Chiefs of Staff",,Washington,"Contact the Joint Chiefs of Staff
  https://www.jcs.mil/Contact.aspx",,,,"Executive Department Sub-Office/Agency/Bureau",DC,"9999 Joint Staff Pentagon",,,,,,"Joint Chiefs of Staff
  https://www.jcs.mil/",20318-9999,,,"The Joint Chiefs of Staff coordinate planning and strategy across the military services.",,Yes,On,"Thu, 02/29/2024 - 15:57
"
English,"Joint Congressional Committee on Inaugural Ceremonies",JCCIC,"Washington ",,,,,Legislative,DC,"S – 407, United States Capitol ",,,1-202-224-0400,,,"Joint Congressional Committee on Inaugural Ceremonies
  https://www.inaugural.senate.gov/","20510 ",,,"Made up of members of the House and Senate, the Joint Congressional Committee on Inaugural Ceremonies (JCCIC) is responsible for planning and carrying out the President&#039;s swearing-in ceremony at the U.S. Capitol.",,Yes,On,"Thu, 02/29/2024 - 16:06
"
English,"Joint Fire Science Program",JFSP,Boise,"Contact the Joint Fire Science Program
  https://www.firescience.gov/ords/prd/jf_jfsp/jf_jfsp/r/jfspublic/contact-us",,,,"Executive Department Sub-Office/Agency/Bureau",ID,"3833 S. Development Ave.",,,,,,"Joint Fire Science Program
  https://www.firescience.gov/",83705,,,"The Joint Fire Science Program (JFSP) provides fire science information, resources and funding announcements for scientists, fire practitioners, and decision makers.",,Yes,On,"Mon, 04/01/2024 - 11:19
"
English,"Joint Forces Staff College",JFSC,"Norfolk ","Contact the Joint Forces Staff College
  https://jfsc.ndu.edu/Contact/",Registrar2@ndu.edu,,,"Executive Department Sub-Office/Agency/Bureau",VA,"7800 Hampton Blvd.",,,1-757-443-6124,,,"Joint Forces Staff College
  https://jfsc.ndu.edu/",23511,,,"The Joint Forces Staff College (JFSC) trains military and civilian decision makers in joint operations planning, strategy, and management.",,Yes,On,"Mon, 04/01/2024 - 11:21
"
English,"Joint Program Executive Office for Chemical, Biological, Radiological and Nuclear Defense",JPEO-CBRND,,"Contact the Joint Program Executive Office for Chemical, Biological, Radiological and Nuclear Defense
  https://www.jpeocbrnd.osd.mil/About-Us/Contact-Us/",,,,"Executive Department Sub-Office/Agency/Bureau",,,,,1-410-436-9000,,,"Joint Program Executive Office for Chemical, Biological, Radiological and Nuclear Defense
  https://www.jpeocbrnd.osd.mil/",,,,"The Joint Program Executive Office for Chemical, Biological, Radiological and Nuclear Defense (JPEO-CBRND) works to deter, detect, and if necessary, deal with the consequences of a weapon of mass destruction attack.",,Yes,On,"Fri, 03/01/2024 - 08:50
"
English,"Judicial Panel on Multidistrict Litigation",JPML,Washington,"Contact the Judicial Panel on Multidistrict Litigation
  http://www.jpml.uscourts.gov/court-info/court-locations",,,,Judicial,DC,"Thurgood Marshall Federal Judiciary Building","One Columbus Circle, NE","Room G-255, North Lobby",1-202-502-2800,,,"Judicial Panel on Multidistrict Litigation
  http://www.jpml.uscourts.gov",20544-0005,,,"The Judicial Panel on Multidistrict Litigation (JPML) determines whether civil actions pending in two or more federal judicial districts should be transferred to a single federal district court for pretrial proceedings.",,Yes,On,"Fri, 03/01/2024 - 09:07
"
English,"Legal Services Corporation",,Washington,"Contact the Legal Services Corporation
  https://www.lsc.gov/about-lsc/contact-us",info@lsc.gov,,,Quasi-official,DC,"3333 K St., NW",,,1-202-295-1500,,,"Legal Services Corporation
  https://www.lsc.gov/",20007-3522,,,"The Legal Services Corporation is an independent corporation founded by Congress that provides grant funds, training, and technical assistance to civil legal aid programs. The Corporation ensures low income individuals and families have access to quality legal aid.","<a href=""/es/agencias/corporacion-de-servicios-legales"" hreflang=""es"">Corporación de Servicios Legales</a>",Yes,On,"Wed, 05/01/2024 - 12:54
"
English,"Library of Congress",,Washington,"Contact the Library of Congress
  https://www.loc.gov/contact/, Copyright questions
  https://www.copyright.gov/help/, Report catalog and authority record errors
  https://www.loc.gov/contact/catalog-record-error-report/",,,,Legislative,DC,"101 Independence Ave., SE",,,"1-202-707-5000, 1-202-707-8000 (visitor information)",,,"Library of Congress 
  https://www.loc.gov/",20540,,,"The Library of Congress provides Congress with objective research to inform the legislative process, administers the national copyright system, and manages the largest collection of books, recordings, photographs, maps and manuscripts in the world.","<a href=""/es/agencias/biblioteca-del-congreso-division-hispanica"" hreflang=""es"">Biblioteca del Congreso, División Hispánica</a>",Yes,On,"Fri, 03/01/2024 - 10:36
"
English,"Marine Mammal Commission",,Bethesda,"Contact the Marine Mammal Commission
  https://www.mmc.gov/about-the-commission/contact-us/",mmc@mmc.gov,,,"Independent Board, Commission, Committee",MD,"4340 East-West Highway","Suite 700",,1-301-504-0087,,,"Marine Mammal Commission
  http://www.mmc.gov/",20814,,,"The Marine Mammal Commission provides oversight of all marine mammal conservation policies and programs carried out by federal regulatory agencies.",,Yes,On,"Wed, 03/15/2023 - 22:02
"
English,"Maritime Administration",MARAD,Washington,"Contact the Maritime Administration
  https://www.maritime.dot.gov/about-us/maritime-contact-information",,,,"Executive Department Sub-Office/Agency/Bureau",DC,"1200 New Jersey Ave., SE",,,1-202-366-4000,"1-800-99-MARAD (1-800-996-2723)",,"Maritime Administration
  https://www.maritime.dot.gov/",20590,,,"The Maritime Commission (MARAD) supports the U.S. merchant marine, improves port efficiency, and maintains an adequate ship building and repair infrastructure.",,Yes,On,"Fri, 03/01/2024 - 13:37
"
English,"Medicaid and CHIP Payment and Access Commission",MACPAC,Washington,"Contact the Medicaid and CHIP Payment and Access Commission 
  https://www.macpac.gov/contact-us/",,,,Legislative,DC,"1800 M Street, NW","Suite 650 South",,1-202-350-2000,,,"Medicaid and CHIP Payment and Access Commission
  https://www.macpac.gov/",20036,,,"The Medicaid and CHIP Payment and Access Commission (MACPAC) reviews federal and state medicaid and CHIP policies and makes recommendations to Congress, the department of health and human services, and the states.",,Yes,On,"Fri, 03/01/2024 - 14:03
"
English,"Medicare Payment Advisory Commission",MedPAC,Washington,"Contact the Medicare Payment Advisory Commission
  https://www.medpac.gov/what-we-do/contact/",webmaster@medpac.gov,,,Legislative,DC,"425 I St., NW","Suite 701",,1-202-220-3700,,,"Medicare Payment Advisory Commission
  http://www.medpac.gov/",20001,,,"The Medicare Payment Advisory Commission (MedPAC) advises Congress on a range of issues affecting Medicare, including payments, services, access, and regulations.",,Yes,On,"Fri, 03/01/2024 - 14:23
"
English,"Merit Systems Protection Board",MSPB,Washington,"Contact the Merit Systems Protection Board
  https://www.mspb.gov/about/contact.htm",mspb@mspb.gov,,,"Independent Agency",DC,"1615 M St., NW",,,1-202-653-7200,"1-800-424-9121 (Inspector General hotline)",1-800-877-8339,"Merit Systems Protection Board
  https://www.mspb.gov/",20419,,,"The Merit Systems Protection Board (MSPB) hears appeals from federal employees, and studies federal merit systems in an effort to protect the rights of federal employees.",,Yes,On,"Mon, 03/04/2024 - 09:09
"
English,"Middle East Broadcasting Networks",,Springfield,,communications@alhurra.com,,,"Executive Department Sub-Office/Agency/Bureau",VA,"7600 Boston Boulevard",,,1-703-852-9000,,,"Alhurra TV
  https://www.alhurra.com/",22153,,,"The Middle East Broadcasting Network operates Alhurra TV. Alhurra TV provide news to the people of the Middle East about the region, the world, and the United States.",,Yes,On,"Wed, 07/23/2025 - 08:04
"
English,"Migratory Bird Conservation Commission",,"Falls Church",,mbcc@fws.gov,,,"Independent Board, Commission, Committee",VA,"5275 Leesburg Pike",,,1-703-358-1716,,,"Migratory Bird Conservation Commission
  https://www.fws.gov/program/land-acquisition-and-realty/migratory-bird-conservation-commission",22041,,,"The Migratory Bird Conservation Commission considers and approves areas of land or water recommended by the Secretary of the Interior for purchase or rental by the U.S. Fish and Wildlife Service.",,Yes,On,"Mon, 03/04/2024 - 09:17
"
English,"Military Postal Service Agency","MPSA ",Arlington,,,,,"Executive Department Sub-Office/Agency/Bureau",VA,"2900 Crystal Dr.","Suite 410",,,,,"Military Postal Service Agency
  https://www.hrc.army.mil/content/Military%20Postal%20Service%20Agency%20(MPSA)",22202-3557,,,"The Military Postal Service Agency (MPSA) provides worldwide postal services to department of defense personnel and their families.",,Yes,On,"Mon, 03/04/2024 - 09:24
"
English,"Millennium Challenge Corporation",MCC,Washington,"Contact the Millennium Challenge Corporation
  https://www.mcc.gov/contact-us",,,,"Independent Agency",DC,"1099 14th Street NW","Suite 700",,1-202-521-3600,,,"Millennium Challenge Corporation
  https://www.mcc.gov/",20005-2221,,,"The Millennium Challenge Corporation (MCC) partners with the best-governed poor countries worldwide to promote economic growth and help people lift themselves out of poverty.",,Yes,On,"Mon, 03/04/2024 - 09:30
"
English,"Mine Safety and Health Administration",MSHA,Arlington,"Contact the Mine Safety and Health Administration
  https://www.msha.gov/about/contact/emergencies, Report a hazardous condition
  https://www.msha.gov/support-resources/forms-online-filing/2015/04/14/mine-accident-injury-and-illness-report",,,,"Executive Department Sub-Office/Agency/Bureau",VA,"201 12th St S","Suite 401",,1-202-693-9400,"1-800-746-1553 (hazardous condition complaints)",,"Mine Safety and Health Administration 
  https://www.msha.gov/",22202-5450,,,"The Mine Safety and Health Administration (MSHA) works to prevent mining related deaths, injuries, and illnesses through mine regulations, inspections, and training programs.",,Yes,On,"Mon, 03/04/2024 - 09:58
"
English,"Minority Business Development Agency",MBDA,Washington,"Contact the Minority Business Development Agency
  https://www.mbda.gov/about-us/contact-us",,,"Minority Business Development Agency business centers near you
  https://www.mbda.gov/mbda-programs/business-centers","Executive Department Sub-Office/Agency/Bureau",DC,"1401 Constitution Ave., NW",,,1-202-482-2332,,,"Minority Business Development Agency
  https://www.mbda.gov/",20230,,,"The Minority Business Development Agency (MBDA) promotes the growth of minority owned and operated businesses.",,Yes,On,"Mon, 03/04/2024 - 10:06
"
English,"Missile Defense Agency",MDA,"Fort Belvoir","Contact the Missile Defense Agency
  https://www.mda.mil/contactus/contact.html",mda.info@mda.mil,,,"Executive Department Sub-Office/Agency/Bureau",VA,"5700 18th St.","Bldg. 245",,,,,"Missile Defense Agency 
  https://www.mda.mil/",22060-5573,,,"The Missile Defense Agency (MDA) is a research, development, and acquisition agency that works on ballistic missile defense systems for the United States and its allies.",,Yes,On,"Mon, 03/04/2024 - 11:50
"
English,"Mississippi River Commission",MRC,Vicksburg,"Contact the Mississippi River Commission
  https://www.mvd.usace.army.mil/Contact.aspx",,,,"Independent Board, Commission, Committee",MS,"1400 Walnut St.",,,1-601-634-5768,,,"Mississippi River Commission
  https://www.mvd.usace.army.mil/About/Mississippi-River-Commission-MRC/",39180,,,"The Mississippi River Commission (MRC) researches and provides policy and work recommendations in the areas of flood control, navigation, and environmental projects.",,Yes,On,"Mon, 03/04/2024 - 11:58
"
English,"National Aeronautics and Space Administration",NASA,Washington,"Contact the National Aeronautics and Space Administration
  https://www.nasa.gov/general/nasa-contact-page/",,,"NASA centers and facilities
  https://www.nasa.gov/centers-and-facilities/","Independent Agency",DC,"NASA Headquarters","300 E St. SW","Suite 5R30",1-202-358-0001,,,"National Aeronautics and Space Administration
  https://www.nasa.gov/",20546,,,"The National Aeronautics and Space Administration (NASA) explores space, and researches Earth systems, the solar system, and the universe.","<a href=""/es/agencias/administracion-nacional-de-aeronautica-y-el-espacio"" hreflang=""es"">Administración Nacional de Aeronáutica y el Espacio</a>",Yes,On,"Mon, 03/04/2024 - 13:33
"
