English,"Pentagon Force Protection Agency",PFPA,,"Contact the Pentagon Force Protection Agency
  https://www.pfpa.mil/Contact/",pfpa.pentagon.cco.mbx.general@mail.mil,,,"Executive Department Sub-Office/Agency/Bureau",,,,,"1-703-697-1001, 1-703-697-5555 (emergencies)",,1-703-693-7008,"Pentagon Force Protection Agency
  https://www.pfpa.mil/",,,,"The Pentagon Force Protection Agency (PFPA) is a civilian agency that protects the occupants, visitors, and infrastructure of Pentagon facilities.",,Yes,On,"Mon, 03/18/2024 - 13:08
"
English,"Pipeline and Hazardous Materials Safety Administration",PHMSA,Washington,"Contact the Pipeline and Hazardous Materials Safety Administration
  https://www.phmsa.dot.gov/about-phmsa/phmsas-mission",,,,"Executive Department Sub-Office/Agency/Bureau",DC,"1200 New Jersey Ave., SE",,,1-202-366-4433,"1-800-424-8802 (report an accident)",,"Pipeline and Hazardous Materials Safety Administration
  http://www.phmsa.dot.gov/",20590,,,"The Pipeline and Hazardous Materials Safety Administration (PHMSA) regulates the transport of hazardous materials.",,Yes,On,"Mon, 03/18/2024 - 13:13
"
English,"Postal Regulatory Commission",,Washington,"Contact the Postal Regulatory Commission
  http://www.prc.gov/contact/",,,,"Independent Agency",DC,"901 New York Ave., NW","Suite 200",,1-202-789-6800,,,"Postal Regulatory Commission
  http://www.prc.gov",20268-0001,,,"The Postal Regulatory Commission is responsible for oversight of the U.S. Postal Service, including oversight of rates and services, and ensuring the Postal Service meets all of its legal requirements.",,Yes,On,"Wed, 03/15/2023 - 22:02
"
English,"President&#039;s Council on Fitness, Sports and Nutrition",PCSFN,Rockville,"Contact the President&#039;s Council on Fitness, Sports and Nutrition
  https://health.gov/about-odphp/contact-us",fitness@hhs.gov,,,"Executive Department Sub-Office/Agency/Bureau",MD,"1101 Wootton Pkwy.","Department W Tower Bldg., Suite 560",,,,,"President&#039;s Council on Fitness, Sports and Nutrition
  https://health.gov/our-work/nutrition-physical-activity/presidents-council",20852,,,"The President&#039;s Council on Fitness (PCSFN) educates and encourages Americans to adopt a healthy lifestyle.","<a href=""/es/agencias/consejo-presidencial-sobre-aptitud-fisica-deportes-y-nutricion"" hreflang=""es"">Consejo Presidencial sobre Aptitud Física, Deportes y Nutrición</a>",Yes,On,"Mon, 03/18/2024 - 14:12
"
English,"Presidio Trust",,,"Contact Presidio Trust
  https://presidio.gov/visit/contact-feedback",presidio@presidiotrust.gov,,,"Independent Board, Commission, Committee",,,,,,,,"Presidio Trust
  http://www.presidio.gov",,,,"The Presidio Trust preserves the Presidio National Park as an enduring resource for the American people.",,Yes,On,"Mon, 03/18/2024 - 14:22
"
English,"Pretrial Services Agency for the District of Columbia",,Washington,"Contact the Pretrial Services Agency for the District of Columbia
  https://www.psa.gov/?q=contact",contact@psa.gov,,"Pretrial Services Agency for the District of Columbia location directory
  https://www.psa.gov/?q=contact/location_directory","Executive Department Sub-Office/Agency/Bureau",DC,"633 Indiana Ave., NW","Suite 1120",,1-202-220-5500,,,"Pretrial Services Agency for the District of Columbia
  https://www.psa.gov/",20004,,,"The Pretrial Services Agency for the District of Columbia&#039;s promotes pretrial justice and enhances community safety.",,Yes,On,"Mon, 03/18/2024 - 14:24
"
English,"Privacy and Civil Liberties Oversight Board",PCLOB,,"Contact the Privacy and Civil Liberties Oversight Board
  https://www.pclob.gov/About/Contact",info@pclob.gov,,,"Independent Agency",,,,,1-202-296-4649,,,"Privacy and Civil Liberties Oversight Board
  https://www.pclob.gov/",,,,"The Privacy and Civil Liberties Oversight Board (PCLOB) ensures that the federal government’s efforts to prevent terrorism are balanced with the need to protect privacy and civil liberties.​",,Yes,On,"Tue, 03/19/2024 - 09:22
"
English,"Public and Indian Housing",PIH,Washington,"Contact Public and Indian Housing
  https://www.hud.gov/program_offices/public_indian_housing/about/css",,,,"Executive Department Sub-Office/Agency/Bureau",DC,"451 7th St., SW",,,,1-800-955-2232,,"Public and Indian Housing
  https://www.hud.gov/program_offices/public_indian_housing",20410,,,"The Office of Public and Indian Housing (PIH) works to ensure safe, decent and affordable housing.",,Yes,On,"Tue, 03/19/2024 - 09:23
"
English,"Radio Free Asia",RFA,Washington,"Contact Radio Free Asia
  https://www.rfa.org/english/about/contact-us/",contact@rfa.org,,,"Executive Department Sub-Office/Agency/Bureau",DC,"2025 M St., NW","Suite 300",,1-202-530-4900,,,"Radio Free Asia 
  http://www.rfa.org/",20036,,,"Radio Free Asia (RFA) broadcasts news and information to China, Tibet, North Korea, Vietnam, Cambodia, Laos, and Burma.",,Yes,On,"Mon, 06/30/2025 - 11:05
"
English,"Radio Free Europe and Radio Liberty",RFE/RL,Washington,"Contact Radio Free Europe/Radio Liberty 
  https://about.rferl.org/contact-us/",,,,"Executive Department Sub-Office/Agency/Bureau",DC,"1250 Connecticut Ave NW, Suite 450",,,1-202-457-6900,,,"Radio Free Europe/Radio Liberty 
  http://www.rferl.org/",20036,,,"Radio Free Europe/Radio Liberty (RFE/RL) broadcasts news and information in 21 countries where a free press is either banned or not fully established.",,Yes,On,"Tue, 03/19/2024 - 09:55
"
English,"Railroad Retirement Board",RRB,Chicago,"Contact the Railroad Retirement Board
  https://www.rrb.gov/ContactUs",,,"Railroad Retirement Board local offices
  https://www.rrb.gov/Field-Office-Locator","Independent Agency",IL,"844 North Rush St.",,,1-312-751-4300,1-877-772-5772,1-312-751-4701,"Railroad Retirement Board 
  https://rrb.gov/",60611-2092,,,"The Railroad Retirement Board (RRB) administers retirement, survivor, unemployment, and sickness benefits for U.S. railroad workers and their families.","<a href=""/es/agencias/junta-de-jubilacion-de-empleados-ferroviarios"" hreflang=""es"">Junta de Jubilación de Empleados Ferroviarios</a>",Yes,On,"Tue, 03/19/2024 - 10:06
"
English,"Rehabilitation Services Administration",RSA,Washington,"Contact the Rehabilitation Services Administration
  https://rsa.ed.gov/about/programs/vocational-rehabilitation-state-grants/contact",,,,"Executive Department Sub-Office/Agency/Bureau",DC,"Office of Special Education and Rehabilitative Services","400 Maryland Ave., SW",,"1-202-401-2000 (Department of Education) ","1-800-872-5327 (Department of Education) ",,"Rehabilitation Services Administration
  https://rsa.ed.gov/",20202-7100,,,"The Rehabilitation Services Administration (RSA) oversees grant programs that help individuals with physical or mental disabilities obtain employment and live more independently.",,Yes,On,"Wed, 07/02/2025 - 09:47
"
English,"Risk Management Agency",RMA,Washington,"Contact the Risk Management Agency
  https://www.rma.usda.gov/en/Contact-Us",,,"Risk Management Agency local offices
  https://www.rma.usda.gov/RMALocal/Field-Offices/Regional-Offices","Executive Department Sub-Office/Agency/Bureau",DC,"1400 Independence Ave., SW","Mailstop 0801",,1-202-690-2803,,,"Risk Management Agency
  http://www.rma.usda.gov/",20250-0801,,,"The United States Department of Agriculture’s (USDA) Risk Management Agency (RMA) administers the Federal Crop Insurance Corporation and provides risk management information and services to farmers and producers.",,Yes,On,"Tue, 03/19/2024 - 10:42
"
English,"Rural Business-Cooperative Service",,Washington,"Contact Rural Business-Cooperative Service
  https://www.rd.usda.gov/about-rd/agencies/rural-business-cooperative-service/contacts",,,"Find Rural Business-Cooperative Service in your state 
  https://www.rd.usda.gov/contact-us/state-offices","Executive Department Sub-Office/Agency/Bureau",DC,"1400 Independence Ave., SW","Rm 5803-S STOP 3201",,1-202-690-4730,,,"Rural Business-Cooperative Service
  https://www.rd.usda.gov/about-rd/agencies/rural-business-cooperative-service",20250-3201,,,"Rural Business-Cooperative Service provides support for rural businesses, usually through grants and loans.",,Yes,On,"Mon, 04/01/2024 - 13:59
"
English,"Rural Development",,,"Contact Rural Development
  https://www.rd.usda.gov/contact-us",,,"Find a Rural Development office in your state
  https://www.rd.usda.gov/contact-us/state-offices","Executive Department Sub-Office/Agency/Bureau",,,,,,,,"Rural Development
  https://www.rd.usda.gov/",,,,"Rural Development offers loans, grants and loan guarantees to support essential services such as housing, economic development, health care, first responder services and equipment, and water, electric and communications infrastructure.",,Yes,On,"Mon, 06/30/2025 - 11:07
"
English,"Rural Housing Service",,Washington,"Contact the Rural Housing Service
  https://www.rd.usda.gov/contact-us/national-office/rhs",,,"Find a Rural Housing Service office in your state
  https://www.rd.usda.gov/contact-us/state-offices","Executive Department Sub-Office/Agency/Bureau",DC,"1400 Independence Ave., SW"," Rm 5014, STOP 0701",,1-202-692-0268,"1-800-414-1226 (customer service center)",,"Rural Housing Service
  https://www.rd.usda.gov/about-rd/agencies/rural-housing-service",20250-0701,,,"The Rural Housing Service provides grants and loans for housing and community facilities in rural areas of the U.S.",,Yes,On,"Tue, 03/19/2024 - 12:54
"
English,"Rural Utilities Service",RUS,Washington,"Contact the Rural Utilities Service
  https://www.rd.usda.gov/contact-us/national-office/rus",,,"Find a Rural Utilities Service office in your state
  https://www.rd.usda.gov/contact-us/state-offices","Executive Department Sub-Office/Agency/Bureau",DC,"1400 Independence Ave., SW","STOP 1510, Rm 4121-S",,1-202-720-9540,,,"Rural Utilities Service
  https://www.rd.usda.gov/about-rd/agencies/rural-utilities-service",20250-1510,,,"The Rural Utilities Service (RUS) provides funding for the development of rural utilities infrastructure such as water, waste management, power and telecommunications.",,Yes,On,"Tue, 03/19/2024 - 13:02
"
English,"Saint Lawrence Seaway Development Corporation",GLS,Washington,"Contact the Saint Lawrence Seaway Development Corporation
  https://www.seaway.dot.gov/about/contact-us",GLS@dot.gov,,,"Executive Department Sub-Office/Agency/Bureau",DC,"1200 New Jersey Ave., SE",,,1-202-366-0091,1-800-785-2779,,"Saint Lawrence Seaway Development Corporation
  http://www.seaway.dot.gov/",20590,,,"The Saint Lawrence Seaway Development Corporation (GLS) works to operate and maintain a safe, reliable, efficient waterway between the Great Lakes and the Atlantic Ocean.",,Yes,On,"Tue, 03/19/2024 - 13:08
"
English,"Secret Service",,Washington,"Contact the Secret Service
  https://www.secretservice.gov/contact",,,"Find a Secret Service office near you
  https://www.secretservice.gov/contact/field-offices","Executive Department Sub-Office/Agency/Bureau",DC,"245 Murray Lane"," SW - BLDG T-5",,1-202-406-5708,,,"Secret Service
  https://www.secretservice.gov/",20223,,,"The Secret Service works to safeguard the nation&#039;s financial infrastructure. The Secret Service is also responsible for protecting national leaders and visiting heads of state.",,Yes,On,"Tue, 03/19/2024 - 13:28
"
English,"Securities and Exchange Commission",SEC,Washington,"Contact the Securities and Exchange Commission
  https://www.sec.gov/contact-information/sec-directory, File an investor complaint
  https://www.sec.gov/oiea/Complaint.html",,,,"Independent Agency",DC,"100 F Street, NE",,,,,,"Securities and Exchange Commission 
  https://www.sec.gov/",20549,,,"The Securities and Exchange Commission (SEC) oversees securities exchanges, securities brokers and dealers, investment advisors, and mutual funds in an effort to promote fair dealing, the disclosure of important market information, and to prevent fraud.","<a href=""/es/agencias/comision-de-bolsa-y-valores"" hreflang=""es"">Comisión de Bolsa y Valores</a>",Yes,On,"Tue, 03/19/2024 - 13:45
"
English,"Selective Service System",SSS,Palatine,"Contact the Selective Service System
  https://www.sss.gov/contact/",DMCSupport@sss.gov,,,"Independent Agency",IL,"PO Box 94638",,,1-847-688-6888,1-888-655-1825,,"Selective Service System 
  https://www.sss.gov/",60094-4638,,,"The Selective Service System (SSS) provides the Department of Defense personnel in the event of a national emergency. Male citizens and immigrants are required to register with the Selective Service when they turn 18.","<a href=""/es/agencias/sistema-de-servicio-selectivo"" hreflang=""es"">Sistema de Servicio Selectivo</a>",Yes,On,"Tue, 03/19/2024 - 13:53
"
English,"Small Business Administration",SBA,Washington,"Contact the Small Business Administration
  https://www.sba.gov/about-sba/organization/contact-sba",answerdesk@sba.gov,,"Find a Small Business Administration office near you
  https://www.sba.gov/about-sba/sba-locations/sba-district-offices","Independent Agency",DC,"409 3rd St., SW",,,,1-800-827-5722,,"Small Business Administration 
  http://www.sba.gov/",20416,,,"The Small Business Administration (SBA) helps Americans start, build and grow businesses. Through an extensive network of field offices and partnerships, the Small Business Administration assists and protects the interests of small business concerns.","<a href=""/es/agencias/agencia-federal-de-pequenos-negocios-de-estados-unidos"" hreflang=""es"">Agencia Federal de Pequeños Negocios de Estados Unidos</a>",Yes,On,"Tue, 03/19/2024 - 14:00
"
English,"Smithsonian Institution",,Washington,"Contact the Smithsonian Institution
  http://www.si.edu/Contacts",info@si.edu,,"Visit the Smithsonian
  http://www.si.edu/Visit",Quasi-official,DC,"PO Box 37012","SI Building, Room 153, MRC 010",,1-202-633-1000,,,"Smithsonian Institution
  http://www.si.edu/",20013-7012,,,"The Smithsonian is the world’s largest museum, education, and research complex, with 21 museums, 21 libraries, the National Zoo, numerous research centers, and several education units and centers.","<a href=""/es/agencias/museos-y-galerias-smithsonian"" hreflang=""es"">Museos y Galerías Smithsonian</a>",Yes,On,"Mon, 03/25/2024 - 08:58
"
English,"Social Security Administration",SSA,Baltimore,"Contact the Social Security Administration
  https://www.ssa.gov/agency/contact/",,,"Find a Social Security office near you
  https://secure.ssa.gov/apps6z/FOLO/fo001.jsp","Independent Agency",MD,"6401 Security Blvd.",,,,1-800-772-1213,,"Social Security Administration 
  http://www.ssa.gov/",21235,,,"The Social Security Administration (SSA) has two main functions. One is to assign Social Security numbers. The other is to run the Social Security retirement, survivors, and disability insurance programs. <br />
A third function is to run the Supplemental Security Income program, for people who are 65 or older, blind, or with a disability.","<a href=""/es/agencias/administracion-del-seguro-social"" hreflang=""es"">Administración del Seguro Social</a>",Yes,On,"Tue, 10/29/2024 - 19:46
"
English,"Social Security Advisory Board",SSAB,,"Contact the Social Security Advisory Board
  https://www.ssab.gov/contact/",ssab@ssab.gov,,,"Independent Board, Commission, Committee",,,,,,,,"Social Security Advisory Board
  https://www.ssab.gov/",,,,"The Social Security Advisory Board (SSAB) advises the president, congress and the commissioner of Social Security on Social Security and Supplemental Security Income policy.",,Yes,On,"Wed, 03/20/2024 - 11:43
"
English,"Southeastern Power Administration",,Elberton,,info2@sepa.doe.gov,,,"Executive Department Sub-Office/Agency/Bureau",GA,"1166 Athens Tech Rd.",,,1-706-213-3800,,,"Southeastern Power Administration
  https://www.energy.gov/sepa/southeastern-power-administration",30635-6711,,,"The Southeastern Power Administration markets hydroelectric power generated by federal reservoirs to public entities in the southeastern United States.",,Yes,On,"Wed, 03/15/2023 - 22:02
"
English,"Southwestern Power Administration",,Tulsa,"Contact the Southwestern Power Administration
  https://www.energy.gov/swpa/contact-us",info@swpa.gov,,,"Executive Department Sub-Office/Agency/Bureau",OK,"One West Third St., Suite 1500",,,1-918-595-6600,,,"Southwestern Power Administration
  https://www.energy.gov/swpa/southwestern-power-administration",74103,,,"The Southwestern Power Administration markets hydroelectric power generated by federal dams to public entities in several states in the South and Southwest.",,Yes,On,"Thu, 05/04/2023 - 11:10
"
English,"State Justice Institute",SJI,Fairfax,,contact@sji.gov,,,Quasi-official,VA,"12700 Fair Lakes Circle","Suite 340",,1-703-660-4979,,,"State Justice Institute
  https://www.sji.gov/",22033,,,"The State Justice Institute (SJI) is a grant-making organization dedicated to improving the quality of justice in all state courts. It also works to facilitate better coordination between state and federal courts.",,Yes,On,"Wed, 03/20/2024 - 12:00
"
English,"Stennis Center for Public Service",,Starkville,,,,,Legislative,MS,"One Research Blvd.","Suite 104",,1-662-325-8409,,,"Stennis Center for Public Service
  http://www.stennis.gov/",39759,,,"The Stennis Center provides leadership training to young people interested in careers in public service. It also offers training and development opportunities to congresspeople and their staffs.",,Yes,On,"Wed, 03/15/2023 - 22:01
"
English,"Substance Abuse and Mental Health Services Administration",SAMHSA,Rockville,"Contact the Substance Abuse and Mental Health Services Administration
  http://www.samhsa.gov/about-us/contact-us, Suicide prevention hotline
  https://988lifeline.org/",SAMHSAInfo@samhsa.hhs.gov,,,"Executive Department Sub-Office/Agency/Bureau",MD,"5600 Fishers Lane",,,,"1-877-726-4727, 1-800-273-8255 (suicide prevention lifeline)",1-800-487-4889,"Substance Abuse and Mental Health Services Administration
  https://www.samhsa.gov/",20857,,,"The Substance Abuse and Mental Health Services Administration (SAMHSA) works to improve substance abuse and mental health treatment services to those who are most in need of them.","<a href=""/es/agencias/administracion-de-salud-mental-y-abuso-de-sustancias"" hreflang=""es"">Administración de Salud Mental y Abuso de Sustancias</a>",Yes,On,"Mon, 05/12/2025 - 12:40
"
English,"Supreme Court of the United States",,Washington,"Contact the Supreme Court of the United States
  http://www.supremecourt.gov/contact/contactus.aspx",,,,Judicial,DC,"One First St., NE",,,"1-202-479-3000, 1-202-479-3030 (visitor information)",,1-202-479-3472,"Supreme Court of the United States
  http://www.supremecourtus.gov/",20543,,,"The U.S. Supreme Court is the final appellate court of the U.S. judicial system. It has the power to review and overturn the decisions of lower courts. The Supreme Court also has original jurisdiction (being the first and final court to hear a case) in certain cases involving public officials, ambassadors, or disputes between states.","<a href=""/es/agencias/corte-suprema-de-estados-unidos"" hreflang=""es"">Corte Suprema de Estados Unidos</a>",Yes,On,"Wed, 03/20/2024 - 13:51
"
English,"Surface Transportation Board",STB,Washington,"Contact the Surface Transportation Board
  https://prod.stb.gov/",,,,"Independent Agency",DC,"395 E St., SW",,,1-202-245-0245,,"1-800-877-8339 (Federal Relay Service)","Surface Transportation Board
  https://www.stb.gov/",20423-0001,,,"The Surface Transportation Board (STB) regulates and decides disputes involving railroad rates, railroad mergers or line sales, and certain other transportation matters.",,Yes,On,"Wed, 03/20/2024 - 14:00
"
English,"Susquehanna River Basin Commission",SRBC,Harrisburg,"Contact the Susquehanna River Basin Commission
  https://www.srbc.net/contact-us.html",srbc@srbc.net,,,"Independent Board, Commission, Committee",PA,"4423 N. Front St.",,,1-717-238-0423,,,"Susquehanna River Basin Commission
  http://www.srbc.net/",17110-1788,,,"The Susquehanna River Basin Commission (SRBC) is an interstate body, with representatives from New York, Maryland, Pennsylvania and the federal government, that manages the environmental stewardship and economic development of the Susquehanna river and its tributaries.",,Yes,On,"Wed, 03/20/2024 - 14:10
"
English,"Tax Court",,Washington,"Contact the Tax Court
  https://www.ustaxcourt.gov/directory.html",,,,Judicial,DC,"400 Second St., NW",,,1-202-521-0700,,,"Tax Court
  http://www.ustaxcourt.gov/",20217,,,"The Tax Court decides disputes between the Internal Revenue Service and taxpayers.",,Yes,On,"Wed, 03/20/2024 - 14:13
"
English,"Tennessee Valley Authority",,Knoxville,"Contact the Tennessee Valley Authority
  https://www.tva.com/about-tva/contact-us",tvainfo@tva.com,,,"Independent Agency",TN,"400 W. Summit Hill Dr.",,,1-865-632-2101,,,"Tennessee Valley Authority
  https://www.tva.com/",37902-1499,,,"The Tennessee Valley Authority (TVA) provides low-cost electricity in seven southeastern states, and provides flood control, navigation, and land management for the Tennessee River system.",,Yes,On,"Thu, 08/01/2024 - 20:03
"
English,"Transportation Security Administration",TSA,,"Contact the Transportation Security Administration
  https://www.tsa.gov/contact",,,,"Executive Department Sub-Office/Agency/Bureau",,,,,,1-866-289-9673,,"Transportation Security Administration 
  https://www.tsa.gov",,,,"The Transportation Security Administration (TSA) protects the nation&#039;s transportation systems to ensure freedom of movement for people and commerce.","<a href=""/es/agencias/administracion-de-seguridad-en-el-transporte"" hreflang=""es"">Administración de Seguridad en el Transporte</a>",Yes,On,"Thu, 03/21/2024 - 09:18
"
English,"U.S. AbilityOne Commission",,Washington,"Contact the U.S. AbilityOne Commission
  https://www.abilityone.gov/contact_us/index.html",info@abilityone.gov,,,"Executive Department Sub-Office/Agency/Bureau",DC,"355 E Street SW","Suite 325",,1-703-603-2100,1-800-999-5963,,"U.S. AbilityOne Commission
  https://www.abilityone.gov/",20024,,,"The AbilityOne Commission creates job opportunities for people who are blind or have other significant disabilities in the manufacture and delivery of products and services to the Federal Government.",,Yes,On,"Thu, 03/21/2024 - 09:24
"
English,"U.S. Access Board",,Washington,"Contact the U.S. Access Board
  https://www.access-board.gov/contact/, File an accessibility complaint
  https://consumercomplaints.fcc.gov/hc/en-us",info@access-board.gov,,,"Executive Department Sub-Office/Agency/Bureau",DC,"1331 F St., NW","Suite 1000",,1-202-272-0080,,,"U.S. Access Board
  https://www.access-board.gov/",20004-1111,,,"The Access Board is an independent federal agency devoted to accessibility for people with disabilities. The Board develops and maintains design criteria for the built environment, transit vehicles, telecommunications equipment, and for electronic and information technology.","<a href=""/es/agencias/consejo-de-accesibilidad-de-servicios-publicos-de-estados-unidos"" hreflang=""es"">Consejo de Accesibilidad de Servicios Públicos de Estados Unidos</a>",Yes,On,"Thu, 03/21/2024 - 09:31
"
English,"U.S. Africa Command",,APO,"Contact the Africa Command
  https://www.africom.mil/contact-us",,,,"Executive Department Sub-Office/Agency/Bureau",AE,"Unit 29951",,,1-314-430-1110,,,"U.S. Africa Command
  https://www.africom.mil/",09751,,,"The U.S. Africa Command strengthens the defense capabilities of African nations.",,Yes,On,"Thu, 03/21/2024 - 09:35
"
English,"U.S. Agency for Global Media",,Washington,"Contact the U.S. Agency for Global Media
  https://www.usagm.gov/contact-us/",publicaffairs@usagm.gov,,,"Independent Agency",DC,"330 Independence Ave., SW",,,1-202-920-2000,,,"U.S. Agency for Global Media
  https://www.usagm.gov/",20237,,,"The U.S. Agency for Global Media, formerly known as the Broadcasting Board of Governors, broadcasts news and information about the United States and the world to audiences abroad.","<a href=""/es/agencias/agencia-de-estados-unidos-para-los-medios-globales"" hreflang=""es"">Agencia de Estados Unidos para los Medios Globales</a>",Yes,On,"Thu, 03/21/2024 - 09:39
"
English,"U.S. Agency for International Development",USAID,Washington,"Contact the U.S. Agency for International Development
  https://www.usaid.gov/contact-us, Staff directory
  https://www.usaid.gov/who-we-are/organization",,,"U.S. Agency for International Development mission directory
  http://www.usaid.gov/mission-directory","Independent Agency",DC,"1300 Pennsylvania Ave, NW",,,1-202-712-4300,,,"U.S. Agency for International Development 
  http://www.usaid.gov/",20004,,,"The U.S. Agency for International Development (USAID) is the principal U.S. agency to extend assistance to countries recovering from disaster, trying to escape poverty, and engaging in democratic reforms.",,Yes,Off,"Tue, 12/16/2025 - 10:20
"
English,"U.S. Air Force",,,"Contact the U.S. Air Force
  https://www.af.mil/Contact-Us/",,,"Air Force recruiter locator
  https://www.airforce.com/find-a-recruiter, Find Air Force installations
  https://www.airforce.com/lifestyle/locations","Executive Department Sub-Office/Agency/Bureau",,,,,1-703-697-3039,,,"U.S. Air Force
  https://www.af.mil/",,,,"The Air Force defends the United States in the air and space.","<a href=""/es/agencias/fuerza-aerea-de-ee-uu"" hreflang=""es"">Fuerza Aérea de EE. UU.</a>",Yes,On,"Thu, 03/21/2024 - 10:03
"
English,"U.S. Air Force Reserve Command",,,"Contact the U.S. Air Force Reserve Command
  https://www.afrc.af.mil/Contact-Us/, Join the Air Force Reserve
  https://afreserve.com/join-now",,,,"Executive Department Sub-Office/Agency/Bureau",,,,,"1-478-327-1748 (public affairs) , 1-800-257-1212 (contact a recruiter)",,,"U.S. Air Force Reserve Command
  https://www.afrc.af.mil/, Air Force Reserve recruiting
  https://www.afreserve.com/",,,,"The Air Force Reserve Command performs missions and supports Air Force operations.",,Yes,On,"Thu, 03/21/2024 - 10:11
"
