Language,Title,Acronym,City,Contact,Email,"English Title","Find an Office Near You","Government Branch",State,"Street 1","Street 2","Street 3","Phone Number","Toll-free Number","TTY Number",Website,Zip,Body,"Meta Description","Page Intro","Language Toggle","Show in A-Z Index",Published,Changed
English,"Administration for Children and Families",ACF,Washington,"Contact the Administration for Children and Families 
  https://www.acf.hhs.gov/about/contact-us, Contact information for state and tribal child support agencies
  https://www.acf.hhs.gov/css/map/state-and-tribal-child-support-agency-contacts, Contact information for Temporary Assistance for Needy Families (Welfare)
  https://www.acf.hhs.gov/ofa/map/about/help-families, Contact information to report child abuse and neglect
  https://www.childwelfare.gov/topics/responding/reporting/how/, Contact your state or territory Low Income Home Energy Assistance Program (LIHEAP) coordinator 
  https://www.acf.hhs.gov/ocs/map/liheap-map-state-and-territory-contact-listing, Contact your tribal Low Income Home Energy Assistance Program (LIHEAP) coordinator 
  https://www.acf.hhs.gov/ocs/map/liheap-map-tribal-contact-listing",,,"Find a Head Start center near you 
  https://eclkc.ohs.acf.hhs.gov/center-locator, Find your local child support office 
  https://headstart.gov/, Find the Administration for Children and Families office in your region 
  https://www.acf.hhs.gov/about/contact-us","Executive Department Sub-Office/Agency/Bureau",DC,"330 C St., SW",,,,,,"Administration for Children and Families
  https://www.acf.hhs.gov/",20201,,,"The Administration for Children and Families (ACF) funds state, territory, local, and tribal organizations to provide family assistance (welfare), child support, child care, Head Start, child welfare, and other programs relating to children and families.","<a href=""/es/agencias/administracion-de-asuntos-de-ninos-y-familias"" hreflang=""es"">Administración de Asuntos de Niños y Familias</a>",Yes,On,"Wed, 04/09/2025 - 17:12
"
English,"Administration for Community Living ",ACL,Washington,"Contact the Administration for Community Living
  https://acl.gov/contact",,,,"Executive Department Sub-Office/Agency/Bureau",DC,"330 C St SW",,,1-202-401-4634,,,"Administration for Community Living
  https://acl.gov/",20201,,,"The Administration for Community Living (ACL) supports the needs of the aging and disability populations, and improves access health care and long-term services.","<a href=""/es/agencias/administracion-para-la-vida-comunitaria"" hreflang=""es"">Administración para la Vida Comunitaria</a>",Yes,On,"Tue, 02/06/2024 - 08:32
"
English,"Administration for Native Americans",ANA,Washington,"Contact the Administration for Native Americans
  https://www.acf.hhs.gov/ana/contact-information/ana-contact-information",anacomments@acf.hhs.gov,,,"Executive Department Sub-Office/Agency/Bureau",DC,"330 C Street, SW","4th Floor",,,1-877-922-9262,,"Administration for Native Americans
  https://www.acf.hhs.gov/ana",20024,,,"The Administration for Native Americans (ANA) promotes self-sufficiency and cultural preservation for Native Americans by providing social and economic development opportunities through financial assistance, training, and technical assistance.","<a href=""/es/agencias/oficina-de-asuntos-indigenas"" hreflang=""es"">Oficina de Asuntos Indígenas (ANA)</a>",Yes,On,"Tue, 02/06/2024 - 08:35
"
English,"Administrative Conference of the United States",ACUS,Washington,"Contact the Administrative Conference of the United States.
  https://www.acus.gov/",info@acus.gov,"the ",,"Independent Agency",DC,"1120 20th St. NW","Suite 706 South",,1-202-480-2080,,,"Administrative Conference of the United States
  https://www.acus.gov/",20036,,,"The Administrative Conference of the United States (ACUS) is an independent federal agency dedicated to improving federal agency administrative processes and procedures.<br />
",,Yes,On,"Tue, 02/06/2024 - 08:38
"
English,"Administrative Office of the U.S. Courts",,Washington,"Contact the Administrative Office of the U.S. Courts
  https://www.uscourts.gov/contact-us",,,"Find a federal court near you 
  https://www.uscourts.gov/federal-court-finder/search",Judicial,DC,"One Columbus Circle, NE",,,1-202-502-2600,,,"Administrative Office of the U.S. Courts
  https://www.uscourts.gov/",20544,,,"The Administrative Office of the United States Courts handles the nonjudicial, administrative business of the United States Courts such as maintaining statistics and managing Court budgets.",,Yes,On,"Mon, 02/05/2024 - 12:45
"
English,"Advisory Council on Historic Preservation",ACHP,Washington,"Contact the Advisory Council on Historic Preservation
  https://www.achp.gov/contact/feedback",achp@achp.gov,,,"Independent Board, Commission, Committee",DC,"401 F St., NW","Suite 308",,1-202-517-0200,,,"Advisory Council on Historic Preservation
  https://www.achp.gov/",20001-2637,,,"The Advisory Council on Historic Preservation (ACHP) encourages the preservation of historic properties across the nation.",,Yes,On,"Tue, 02/06/2024 - 08:43
"
English,"African Development Foundation",USADF,Washington,"Contact the African Development Foundation
  https://www.usadf.gov/",africa_support@usadf.gov,,,"Independent Agency",DC,"1400 I St., NW",,,,,,"African Development Foundation
  https://www.usadf.gov/",20005-2248,,,"The African Development Foundation (USADF) provides grants to community groups and small enterprises that benefit under-served and marginalized groups in Africa.",,Yes,On,"Mon, 01/12/2026 - 09:53
"
English,"Agency for Healthcare Research and Quality",AHRQ,Rockville,"Contact the Agency for Healthcare Research and Quality
  https://www.ahrq.gov/contact/index.html",,,"Maps and directions to the Agency for Healthcare Research and Quality
  https://www.ahrq.gov/cpi/about/directions/index.html","Executive Department Sub-Office/Agency/Bureau",MD,"Office of Communications ","5600 Fishers Lane, 7th Floor",,1-301-427-1104,,,"Agency for Healthcare Research and Quality
  https://www.ahrq.gov/",20857,,,"The Agency for Healthcare Research and Quality (AHRQ) supports research to improve the quality, safety, efficiency, and effectiveness of health care for all Americans.","<a href=""/es/agencias/agencia-para-la-investigacion-y-la-calidad-del-cuidado-de-la-salud"" hreflang=""es"">Agencia para la Investigación y la Calidad del Cuidado de la Salud</a>",Yes,On,"Tue, 02/06/2024 - 09:01
"
English,"Agency for Toxic Substances and Disease Registry (ATSDR)",,Atlanta,"Contact the Agency for Toxic Substances and Disease Registry
  https://www.atsdr.cdc.gov/contacts.html",,,"Find your regional office of the Agency for Toxic Substances and Disease Registry
  https://www.atsdr.cdc.gov/regional-offices/index.html","Executive Department Sub-Office/Agency/Bureau",GA,"1600 Clifton Road",,,,"1-800-CDC-INFO (1-800-232-4636)",1-888-232-6348,"Agency for Toxic Substances and Disease Registry
  https://www.atsdr.cdc.gov/",30329,,,"The Agency for Toxic Substances and Disease Registry (ATSDR) responds to, and protects people from harmful chemical exposures.","<a href=""/es/agencias/agencia-para-sustancias-toxicas-y-el-registro-de-enfermedades"" hreflang=""es"">Agencia para Sustancias Tóxicas y el Registro de Enfermedades</a>",Yes,On,"Mon, 06/30/2025 - 09:50
"
English,"Agricultural Marketing Service",AMS,,"Contact the Agricultural Marketing Service
  https://www.ams.usda.gov/about-ams/contact-us",amsadministratoroffice@ams.usda.gov,,"Find your local farmers market in the National Farmers Market directory 
  https://www.ams.usda.gov/local-food-directories/farmersmarkets","Executive Department Sub-Office/Agency/Bureau",,,,,1-202-720-8998,,,"Agricultural Marketing Service
  https://www.ams.usda.gov/",,,,"The Agricultural Marketing Service (AMS) supports the fair marketing of U.S. agricultural products.",,Yes,On,"Fri, 03/29/2024 - 11:20
"
English,"Agricultural Research Service",ARS,Washington,"Contact the Agricultural Research Service
  https://www.ars.usda.gov/contact-us/?modeCode=00-00-00-00",,,"Find an Agricultural Research Service office near you
  https://www.ars.usda.gov/people-locations/find-a-location/","Executive Department Sub-Office/Agency/Bureau",DC,"1400 Independence Ave., S.W.",,,,,,"Agricultural Research Service
  https://www.ars.usda.gov/",20250,,,"The Agricultural Research Service (ARS) works to find solutions to agricultural problems.",,Yes,On,"Mon, 06/30/2025 - 09:42
"
English,"Alcohol and Tobacco Tax and Trade Bureau",TTB,,"Contact the Alcohol and Tobacco Tax and Trade Bureau
  https://www.ttb.gov/about-ttb/contact-us",,,"Find a field office of The Alcohol and Tobacco Tax and Trade Bureau
  https://www.ttb.gov/trade-investigations/tid-map","Executive Department Sub-Office/Agency/Bureau",,,,,,,,"Alcohol and Tobacco Tax and Trade Bureau
  https://www.ttb.gov",,,,"The Alcohol and Tobacco Tax and Trade Bureau (TTB) collects taxes and enforces regulations on alcohol, tobacco, firearms, and ammunition.","<a href=""/es/agencias/oficina-de-impuestos-y-comercio-de-las-bebidas-alcoholicas-y-del-tabaco"" hreflang=""es"">Oficina de Impuestos y Comercio de las Bebidas Alcohólicas y del Tabaco</a>",Yes,On,"Wed, 05/01/2024 - 10:53
"
English,"American Battle Monuments Commission",ABMC,Arlington,"Contact the American Battle Monuments Commission
  https://www.abmc.gov/contact-us, Order floral decorations for grave sites
  https://www.abmc.gov/about-us/our-services/flowers-our-sites",info@abmc.gov,,"Locate cemeteries and memorials
  https://www.abmc.gov/cemeteries-memorials, Search for individuals buried or memorialized overseas
  https://www.abmc.gov/","Independent Board, Commission, Committee",VA,"Courthouse Plaza II, Suite 500","2300 Clarendon Boulevard",,1-703-584-1501,,,"American Battle Monuments Commission
  https://www.abmc.gov/",22201,,,"The American Battle Monuments Commission (ABMC) manages 24 military cemeteries abroad, and 25 memorials, monuments, and markers. Nearly all the cemeteries and memorials honor those who served in World War I or World War II.",,Yes,On,"Thu, 02/08/2024 - 10:54
"
English,AmeriCorps,,Washington,"Contact AmeriCorps
  https://www.americorps.gov/",,,"Find an AmeriCorps office in your region 
  https://www.americorps.gov/","Independent Agency",DC,"250 E Street SW",,,,1-800-942-2677,,"AmeriCorps
  https://americorps.gov/",20525,,,"Formerly known as the Corporation for National and Community Service, AmeriCorps, and AmeriCorps Seniors engage volunteers in serving directly with nonprofit organizations to tackle the nation&#039;s most pressing challenges.","<a href=""/es/agencias/corporacion-para-el-servicio-nacional-y-comunitario"" hreflang=""es"">Corporación para el Servicio Nacional y Comunitario</a>",Yes,On,"Mon, 01/26/2026 - 20:45
"
English,"AmeriCorps Seniors",,Washington,"Contact AmeriCorps Seniors
  https://www.americorps.gov/, Find a volunteer opportunity with AmeriCorps Seniors near you
  https://www.americorps.gov/",,,,"Independent Agency",DC,"250 E St. SW",,,,1-800-942-2677,,"AmeriCorps Seniors
  https://www.americorps.gov/",20525,,,"AmeriCorps Seniors is a network of volunteer programs for Americans 55 years and older. Volunteers work in their community doing academic tutoring and mentoring, elderly care, disaster relief, and more.",,Yes,On,"Mon, 01/26/2026 - 20:46
"
English,"Animal and Plant Health Inspection Service",APHIS,Riverdale,"Contact the Animal and Plant Health Inspection Service
  https://www.aphis.usda.gov/aphis/banner/contactus",,,,"Executive Department Sub-Office/Agency/Bureau",MD,"Animal and Plant Health Inspection Service","Department of Agriculture","4700 River Road",1-202-720-2511,,,"Animal and Plant Health Inspection Service
  https://www.aphis.usda.gov/aphis/home/",20737,,,"The Animal and Plant Health Inspection Service (APHIS) protects and promotes U.S. agricultural health, regulates genetically engineered organisms, administers the Animal Welfare Act, and manages wildlife damage.","<a href=""/es/agencias/servicio-de-inspeccion-sanitaria-de-animales-y-plantas"" hreflang=""es"">Servicio de Inspección Sanitaria de Animales y Plantas</a>",Yes,On,"Tue, 02/06/2024 - 12:32
"
English,"Antitrust Division",,Washington,"Contact the Antitrust Division
  https://www.justice.gov/atr/contact-information, Report antitrust concerns
  https://www.justice.gov/atr/citizen-complaint-center",antitrust.atr@usdoj.gov,,"Find an Antitrust Division office near you 
  https://www.justice.gov/atr/sections-and-offices","Executive Department Sub-Office/Agency/Bureau",DC,"950 Pennsylvania Ave., NW",,,,,,"Antitrust Division
  https://www.justice.gov/atr",20530-0001,,,"The Antitrust Division promotes economic competition through enforcing and providing guidance on antitrust laws and principles.","<a href=""/es/agencias/division-antimonopolios"" hreflang=""es"">División Antimonopolios</a>",Yes,On,"Tue, 12/16/2025 - 13:40
"
English,"Appalachian Regional Commission",ARC,Washington,"Contact the Appalachian Regional Commission
  https://www.arc.gov/contact-arc/",,,,"Independent Board, Commission, Committee",DC,"1666 Connecticut Ave. NW","Suite 700",,1-202-884-7700,,,"Appalachian Regional Commission
  https://www.arc.gov/",20009,,,"The Appalachian Regional Commission (ARC) works for sustainable community and economic development in Appalachia.",,Yes,On,"Fri, 03/29/2024 - 12:26
"
English,"Architect of the Capitol",,Washington,"Contact the Architect of the Capitol
  https://www.aoc.gov/contact-form",,,"Book a tour of the U.S. Capitol
  https://www.visitthecapitol.gov/visit",Legislative,DC,"SB-15 U.S. Capitol","U.S. Capitol Building",,1-202-228-1793,,,"Architect of the Capitol
  https://www.aoc.gov/, Online tour of the U.S. Capitol
  https://www.capitol.gov/",20515,,,"The Architect of the Capitol manages and maintains the U.S. Capitol, the Capitol Visitor Center, the Senate Office Buildings, the House Office Buildings, the Supreme Court Building, the Library of Congress, the U.S. Botanic Garden, and the Capitol Grounds",,Yes,On,"Tue, 02/06/2024 - 13:46
"
English,"Armed Forces Retirement Home",AFRH,,"Contact the Armed Forces Retirement Home
  https://www.afrh.gov/contactus",Admissions@afrh.gov,,,"Executive Department Sub-Office/Agency/Bureau",,,,,"1-202-541-7501 (to contact a Washington, DC campus resident), 1-228-897-4418 (to contact a Gulfport, MS campus resident)","1-800-422-9988 (Washington, DC campus), 1-800-422-9988 (Gulfport, MS campus)",,"Armed Forces Retirement Home
  http://www.afrh.gov/",,,,"The Gulfport and Washington campuses of the Armed Forces Retirement Home (AFRH) are retirement centers for veterans of the U.S. military.",,Yes,On,"Tue, 02/06/2024 - 14:07
"
English,"Arms Control and International Security",,Washington,"Contact the Office of the Under Secretary of State for Arms Control and International Security
  https://register.state.gov/contactus/contactusform",,,,"Executive Department Sub-Office/Agency/Bureau",DC,"U.S. Department of State","2201 C St., NW",,1-202-647-4000,,1-800-877-8339,"Arms Control and International Security
  https://www.state.gov/bureaus-offices/under-secretary-for-arms-control-and-international-security-affairs/",20520,,,"The Office of the Under Secretary of State for Arms Control and International Security serves as senior adviser to the president and the secretary of state for arms control, nonproliferation, and disarmament.",,Yes,On,"Wed, 02/07/2024 - 11:13
"
English,"Bankruptcy Courts",,,"Contact the Bankruptcy Courts
  https://www.uscourts.gov/about-federal-courts/federal-courts-public/court-website-links#districtbankruptcy",,,"Find Bankruptcy Courts offices near you
  https://www.uscourts.gov/federal-court-finder/search",Judicial,,,,,,,,"Bankruptcy Courts
  https://www.uscourts.gov/services-forms/bankruptcy",,,,"Each of the 94 federal judicial districts  handles bankruptcy matters, and in almost all districts, bankruptcy cases are filed in the bankruptcy court. Bankruptcy laws help people who can no longer pay their creditors get a fresh start by liquidating their assets to pay their debts, or by creating a repayment plan.",,Yes,On,"Tue, 04/30/2024 - 15:35
"
English,"Barry M. Goldwater Scholarship and Excellence in Education Foundation",,"Saint Peter","Contact the Barry M. Goldwater Scholarship and Excellence in Education Foundation
  https://goldwaterscholarship.gov/contact-us/",,,"Find a Goldwater Scholarship faculty representative
  https://goldwaterscholarship.gov/campus-representative-locator/","Independent Board, Commission, Committee",MN,"Barry M. Goldwater Scholarship and Excellence in Education Foundation","Scholarship America","One Scholarship Way",1-507-931-8335,,,"Barry M. Goldwater Scholarship and Excellence in Education Foundation
  https://goldwaterscholarship.gov/",56082,,,"The Barry Goldwater Scholarship and Excellence in Education Foundation awards scholarships to college students who intend to pursue careers in science, mathematics, and engineering.",,Yes,On,"Tue, 06/03/2025 - 16:26
"
English,"Bonneville Power Administration",BPA,Portland,"Contact the Bonneville Power Administration
  https://www.bpa.gov/about/who-we-are/contact-form",,,,"Executive Department Sub-Office/Agency/Bureau",OR,"905 NE 11th Ave.",,,1-503-230-3000,1-800-282-3713,,"Bonneville Power Administration
  https://www.bpa.gov",97232,,,"The Bonneville Power Administration (BPA) creates and delivers a reliable power supply to the Pacific Northwest.",,Yes,On,"Wed, 02/07/2024 - 12:54
"
English,"Bureau of Alcohol, Tobacco, Firearms and Explosives",ATF,Washington,"Contact the Bureau of Alcohol, Tobacco, Firearms and Explosives
  https://www.atf.gov/contact",ATFTips@atf.gov,,,"Executive Department Sub-Office/Agency/Bureau",DC,"99 New York Ave. NE",,,"1-202-648-7777 (for criminal intelligence/law enforcement matters only), 1-202-648-8520","1-800-800-3855 (for criminal intelligence/law enforcement matters only)",,"Bureau of Alcohol, Tobacco, Firearms and Explosives
  https://www.atf.gov/",20226,,,"The Bureau of Alcohol, Tobacco, Firearms and Explosives (ATF) enforces federal criminal laws regulating the firearms and explosives industries.","<a href=""/es/agencias/agencia-de-alcohol-tabaco-armas-de-fuego-y-explosivos"" hreflang=""es"">Agencia de Alcohol, Tabaco, Armas de Fuego y Explosivos</a>",Yes,On,"Wed, 05/01/2024 - 11:23
"
English,"Bureau of Consular Affairs",,Washington,"Contact the Bureau of Consular Affairs
  https://travel.state.gov/content/travel/en/contact.html",,,,"Executive Department Sub-Office/Agency/Bureau",DC,"2201 C St., NW",,,"1-202-501-4444 (for emergencies abroad)","1-888-407-4747 (for emergencies abroad), 1-877-487-2778 (for U.S. passports)","1-888-874-7793 (for U.S. passports)","Bureau of Consular Affairs
  http://travel.state.gov/",20520,,,"The Bureau of Consular Affairs provides passport services to U.S. citizens, issues Visas to enter the U.S., manages the Diversity Visa Lottery, and provides services to U.S. citizens abroad.","<a href=""/es/agencias/oficina-de-servicios-para-ciudadanos-en-el-exterior"" hreflang=""es"">Oficina de Servicios para Ciudadanos en el Exterior</a>",Yes,On,"Mon, 08/12/2024 - 14:53
"
English,"Bureau of Economic Analysis",BEA,Washington,"Contact the Bureau of Economic Analysis 
  https://www.bea.gov/help/contact-us, Contact a subject matter expert from the Bureau of Economic Analysis
  https://www.bea.gov/help/contact-us/subject-matter-experts",,,,"Executive Department Sub-Office/Agency/Bureau",DC,"4600 Silver Hill Rd.",,,1-301-278-9004,,,"Bureau of Economic Analysis
  https://www.bea.gov/",20233,,,"The Bureau of Economic Analysis (BEA) produces economic accounts statistics that enable government and business decision makers, researchers, and the American public to follow and understand the performance of the Nation&#039;s economy.",,Yes,On,"Wed, 02/07/2024 - 13:36
"
English,"Bureau of Engraving and Printing",BEP,Washington,"Contact the Bureau of Engraving and Printing
  https://www.bep.gov/contact-us",moneyfactory.info@bep.gov,,,"Executive Department Sub-Office/Agency/Bureau",DC,"14th and C Sts., SW",,,"1-202-874-2330 (public tour information)","1-877-874-4114, 1-866-874-2330 (public tour information)",,"Bureau of Engraving and Printing
  https://www.moneyfactory.gov/",20228,,,"The Bureau of Engraving and Printing (BEP) produces United States currency notes and serves to ensure that adequate amounts of currency and coin are in circulation.","<a href=""/es/agencias/oficina-de-grabado-e-impresion"" hreflang=""es"">Oficina de Grabado e Impresión</a>",Yes,On,"Mon, 08/25/2025 - 08:30
"
English,"Bureau of Indian Affairs",BIA,Washington,"Contact the Bureau of Indian Affairs
  https://www.bia.gov/contact-us, Tribal leaders directory
  https://www.bia.gov/bia/ois/tribal-leaders-directory/",feedback@bia.gov,,"Find regional offices of the Bureau of Indian Affairs
  https://www.bia.gov/regional-offices","Executive Department Sub-Office/Agency/Bureau",DC,MS-4606-MIB,"1849 C St., NW",,1-202-208-5116,,,"Bureau of Indian Affairs
  https://www.bia.gov/",20240,,,"The mission of the Bureau of Indian Affairs (BIA) is to enhance the quality of life, to promote economic opportunity, and to carry out the responsibility to protect and improve the trust assets of American Indians, Indian tribes, and Alaska Natives.",,Yes,On,"Wed, 02/07/2024 - 14:06
"
English,"Bureau of Industry and Security",BIS,Washington,"Contact the Bureau of Industry and Security
  https://www.bis.doc.gov/index.php/about-bis/contact-bis, Report a violation to the Bureau of Industry and Security
  https://www.bis.doc.gov/index.php/component/rsform/form/14?task=forms.edit",,,,"Executive Department Sub-Office/Agency/Bureau",DC,"14th St. and Constitution Ave., NW",,,"1-202-482-4811, 1-202-482-6031 (export seminars)","1-800-424-2980 (export enforcement hotline)",,"Bureau of Industry and Security
  https://www.bis.doc.gov/",20230,,,"The Bureau of Industry and Security (BIS) promotes the nation’s economic development and technological advancement by ensuring an effective export control and treaty compliance system.",,Yes,On,"Fri, 03/29/2024 - 12:54
"
English,"Bureau of International Labor Affairs",ILAB,Washington,"Contact the Bureau of International Labor Affairs
  https://www.dol.gov/general/contact",Contact-ILAB@dol.gov,,,"Executive Department Sub-Office/Agency/Bureau",DC,"200 Constitution Ave., NW",,,1-202-693-4770,1-866-487-2365,1-877-889-5627,"Bureau of International Labor Affairs
  https://www.dol.gov/agencies/ilab",20210,,,"The Bureau of International Labor Affairs (ILAB) works to improve working conditions, raise living standards, protect workers’ ability to exercise their rights, and address the workplace exploitation of children and other vulnerable populations.",,Yes,On,"Thu, 02/08/2024 - 09:52
"
English,"Bureau of Justice Statistics",BJS,Washington,"Contact the Bureau of Justice Statistics
  https://bjs.ojp.gov/contact-us, Office of Justice Programs Resources 
  https://www.ojp.gov/ncjrs/new-ojp-resources",askbjs@usdoj.gov,,,"Executive Department Sub-Office/Agency/Bureau",DC,"999 North Capitol Street, NE",,,1-202-307-0765,,,"Bureau of Justice Statistics
  https://bjs.ojp.gov/",20531,,,"The Bureau of Justice Statistics (BJS) publishes information on crime, criminal offenders, victims of crime, and the operation of justice systems.",,Yes,On,"Mon, 07/21/2025 - 08:43
"
English,"Bureau of Labor Statistics",BLS,Washington,"Contact the Bureau of Labor Statistics
  https://stats.bls.gov/bls/contact.htm",,,"Find regional offices of the Bureau of Labor Statistics
  https://www.bls.gov/bls/regnhome.htm","Executive Department Sub-Office/Agency/Bureau",DC,"4600 Silver Hill Road",,,1-202-691-5200,,,"Bureau of Labor Statistics
  https://stats.bls.gov/",20212-0002,,,"The Bureau of Labor Statistics (BLS) measures labor market activity, working conditions, and price changes in the economy.",,Yes,On,"Tue, 05/06/2025 - 18:36
"
English,"Bureau of Land Management",BLM,Washington,"Contact the Bureau of Land Management
  https://www.blm.gov/office/national-office",,,,"Executive Department Sub-Office/Agency/Bureau",DC,"1849 C St., NW",,,1-202-208-3801,,,"Bureau of Land Management 
  https://www.blm.gov/",20240,,,"The Bureau of Land Management (BLM) manages outdoor recreation, livestock grazing, mineral development, and energy production on public lands.","<a href=""/es/agencias/oficina-de-administracion-de-tierras"" hreflang=""es"">Oficina de Administración de Tierras</a>",Yes,On,"Fri, 03/29/2024 - 12:59
"
English,"Bureau of Ocean Energy Management",BOEM,Washington,"Contact the Bureau of Ocean Energy Management
  https://www.boem.gov/about-boem/contact-us",BOEMPublicAffairs@boem.gov,,,"Executive Department Sub-Office/Agency/Bureau",DC,"1849 C St., NW",,,1-202-208-6474,,,"Bureau of Ocean Energy Management
  https://www.boem.gov/",20240,,,"The Bureau of Ocean Energy Management (BOEM) promotes energy independence, environmental protection, and economic development by managing offshore energy resources.","<a href=""/es/agencias/oficina-de-administracion-de-energia-oceanica"" hreflang=""es"">Oficina de Administración de Energía Oceánica</a>",Yes,On,"Thu, 02/08/2024 - 12:14
"
English,"Bureau of Reclamation",,Washington,"Contact the Bureau of Reclamation
  https://www.usbr.gov/main/offices.html, Send a comment to the Bureau of Reclamation
  https://www.usbr.gov/main/comments.cfm",,,,"Executive Department Sub-Office/Agency/Bureau",DC,"Bureau of Reclamation","1849 C St., NW",,,,,"Bureau of Reclamation
  https://www.usbr.gov/",20240-0001,,,"The Bureau of Reclamation is a provider of wholesale water and hydroelectric power in the U.S.","<a href=""/es/agencias/oficina-de-recuperacion"" hreflang=""es"">Oficina de Recuperación</a>",Yes,On,"Thu, 02/08/2024 - 12:48
"
