Español,"Agencia de Protección Ambiental de Estados Unidos",EPA,Washington,"Contacte a la Agencia de Protección Ambiental 
  https://espanol.epa.gov/espanol/forms/contactenos-sobre-el-sitio-epa-en-espanol-preocupaciones-ambientales-o-alguna-pregunta",,"(U.S. Environmental Protection Agency &amp;#8211; EPA)",,None,DC,"Environmental Protection Agency","1200 Pennsylvania Avenue, N.W. ",,,,,"Agencia de Protección Ambiental de Estados Unidos (EPA, sigla en inglés)
  https://espanol.epa.gov/",20460,,,"La Agencia de Protección Ambiental (EPA, sigla en inglés) protege la salud de los seres humanos, el medio ambiente y los recursos naturales. Previene y controla la contaminación del aire y el agua mediante el desarrollo de estándares para la calidad del aire y las emisiones de automóviles, programas para asegurar la limpieza del agua e información sobre la salud ambiental.","<a href=""/agencies/environmental-protection-agency"" hreflang=""en"">Environmental Protection Agency</a>",Yes,On,"Tue, 02/20/2024 - 13:21
"
Español,"Agencia Federal de Pequeños Negocios de Estados Unidos",SBA,Washington,,answerdesk@sba.com,"(Small Business Administration – SBA)",,None,DC,"Small Business Administration (SBA)","409 3rd Street, SW, Suite 7600",,,"1-800-827-5722 (para español presione el 2)",1-704-344-6640,"Agencia Federal de Pequeños Negocios de Estados Unidos (SBA, sigla en inglés)
  https://www.sba.gov/espanol",20416,,,"La Agencia Federal de Pequeños Negocios de Estados Unidos (SBA, sigla en inglés) ayuda al público a comenzar y hacer crecer sus negocios. Por medio de una red de oficinas y socios locales, ayuda, aconseja y protege los intereses de la pequeña empresa.","<a href=""/agencies/small-business-administration"" hreflang=""en"">Small Business Administration</a>",Yes,On,"Fri, 07/21/2023 - 11:40
"
Español,"Agencia Federal para el Manejo de Emergencias",FEMA,Hyattsville,"Contacte a la Agencia Federal para el Manejo de Emergencias 
  https://www.fema.gov/es/about/contact",,"(Federal Emergency Management Agency &amp;#8211; FEMA)",,None,MD,FEMA,"P.O. Box 10055",,"1-202-646-2500 (en inglés)","1-800-621-3362 (para español presione el 2)",,"Agencia Federal para el Manejo de Emergencias (FEMA, sigla en inglés)
  https://www.fema.gov/es",20782-8055,,,"La Agencia Federal para el Manejo de Emergencias (FEMA, sigla en inglés) protege a la nación contra todo tipo de riesgos y desastres, tales como inundaciones, terremotos, tornados, huracanes y emergencias nacionales. La Agencia ofrece un programa de recuperación para individuos y negocios en caso de un desastre.","<a href=""/agencies/federal-emergency-management-agency"" hreflang=""en"">Federal Emergency Management Agency</a>",Yes,On,"Wed, 02/21/2024 - 14:40
"
Español,"Agencia para la Investigación y la Calidad del Cuidado de la Salud",AHRQ,Rockville,,,"(Agency for Healthcare Research and Quality - AHRQ)",,None,MD,"Agency for Healthcare Research and Quality","Office of Communications","5600 Fishers Lane, 7th Floor","1-301-427-1104 (en inglés)",,,"Agencia para la Investigación y la Calidad del Cuidado de la Salud (AHRQ, sigla en inglés)
  https://www.ahrq.gov/topics/informacion-en-espanol/index.html",20857,,,"La Agencia para la Investigación y la Calidad del Cuidado de la Salud (AHRQ, sigla en inglés) apoya, dirige y disemina la investigación que mejora el acceso al cuidado de la salud. Esta agencia investiga la calidad, el costo y los resultados de los servicios del cuidado de la salud para mejorar la organización y la calidad de estos servicios.","<a href=""/agencies/agency-for-healthcare-research-and-quality"" hreflang=""en"">Agency for Healthcare Research and Quality</a>",Yes,On,"Fri, 07/21/2023 - 14:39
"
Español,"Agencia para Sustancias Tóxicas y el Registro de Enfermedades",ATSDR,Atlanta,,,"(Agency for Toxic Substances and Disease Registry &amp;#8211; ATSDR)",,None,GA,ATSDR,"4770 Buford Hwy, NE (MS S101-2)",,,"1-800-232-4636 (para español presione el 2)",,"Agencia para Sustancias Tóxicas y el Registro de Enfermedades (ATSDR, sigla en inglés) 
  https://www.atsdr.cdc.gov/es/index.html",30341,,,"La Agencia para Sustancias Tóxicas y el Registro de Enfermedades (ATSDR, sigla en inglés) protege al público de las sustancias peligrosas y los derrames de éstas en el medio ambiente. Además, evalúa los efectos que tiene en los humanos la exposición a las sustancias peligrosas.","<a href=""/agencies/agency-for-toxic-substances-and-disease-registry"" hreflang=""en"">Agency for Toxic Substances and Disease Registry (ATSDR)</a>",Yes,On,"Fri, 07/21/2023 - 10:10
"
Español,"Biblioteca del Congreso, División Hispánica",,Washington,"Contacte a la Biblioteca del Congreso, División Hispánica
  https://ask.loc.gov/caribbean-iberia-latin-america/#s-la-box-85416-container-tab1",,"(Library of Congress)",,None,DC,"The Library of Congress","101 Independence Ave. SE",,"1-202-707-5397 (para preguntas en español sobre alguna referencia)",,,"Biblioteca del Congreso, División Hispánica
  https://www.loc.gov/rr/hispanic/sala/",20540,,,"La Biblioteca del Congreso es la entidad cultural más antigua en Estados Unidos. Sirve como la institución de investigación para el Congreso. Conserva una colección universal de más de 17 millones de libros y 95 millones de mapas, manuscritos, fotografías, películas, grabaciones de audio, grabados y dibujos.","<a href=""/agencies/library-of-congress"" hreflang=""en"">Library of Congress</a>",Yes,On,"Fri, 10/13/2023 - 10:19
"
Español,"Biblioteca Nacional de Agricultura (NAL) ",,Beltsville,"Contacte a la Biblioteca Nacional de Agricultura (en inglés)
  https://www.nal.usda.gov/contact-us",,"(National Agricultural Library)",,None,MD,"National Agricultural Library","10301 Baltimore Avenue",,"1-301-504-5755 (en inglés)",,,"Página en inglés de la Biblioteca Nacional de Agricultura (NAL, sigla en inglés)
  https://www.nal.usda.gov/",20705,,,"La Biblioteca Nacional de Agricultura (NAL, sigla en inglés) es la fuente principal de información e investigación sobre agricultura.","<a href=""/agencies/national-agricultural-library"" hreflang=""en"">National Agricultural Library</a>",Yes,On,"Mon, 03/04/2024 - 13:43
"
Español,"Biblioteca Nacional de Medicina",NLM,Bethesda,"Contacte a la Biblioteca Nacional de Medicina (en inglés)
  https://support.nlm.nih.gov/support/create-case/",,"(National Library of Medicine - NLM)",,None,MD,"U.S. National Library of Medicine","8600 Rockville Pike",,,,,"Página en inglés de la Biblioteca Nacional de Medicina (NLM, sigla en inglés)
  https://www.nlm.nih.gov/",20894,,,"La Biblioteca Nacional de Medicina (NLM, sigla en inglés) es la biblioteca de medicina más grande del mundo. Es una fuente de información médica y servicios de investigación en biomedicina y atención médica.","<a href=""/agencies/national-library-of-medicine"" hreflang=""en"">National Library of Medicine</a>",Yes,On,"Thu, 03/07/2024 - 12:57
"
Español,"Buró Federal de Investigaciones",FBI,"Washington,","Contacte al Buró Federal de Investigaciones
  https://www.fbi.gov/news/espanol/contactar",,"Federal Bureau of Investigation",,None,DC,"935 Pennsylvania Ave. NW",,,"1-202-324-3000 (en inglés)",,,"Página en inglés del Buró Federal de Investigaciones (FBI, sigla en inglés)
  https://www.fbi.gov/, Información en español 
  https://www.fbi.gov/news/espanol",20535-0001,,,"El Buró Federal de Investigaciones (FBI, sigla en inglés) es la principal rama de investigación del Departamento de Justicia de EE. UU. Su misión es proteger y defender al país de amenazas terroristas y de inteligencia extranjera, hacer cumplir las leyes penales de EE. UU. y proporcionar servicios de liderazgo y justicia a las agencias federales, estatales, municipales y organizaciones internacionales asociadas.","<a href=""/agencies/federal-bureau-of-investigation"" hreflang=""en"">Federal Bureau of Investigation</a>",Yes,On,"Fri, 10/13/2023 - 10:24
"
Español,"Cámara de Representantes de Estados Unidos",,Washington,"Contacte a la Cámara de Representantes de Estados Unidos (en inglés)
  http://www.house.gov/representatives/",,"(House of Representatives, Congress)",,Legislative,DC,"U.S. House of Representatives",,,"1-202-224-3121 (en inglés)",,"1-202-225-1904 (en inglés)","Cámara de Representantes de Estados Unidos (en inglés)
  http://www.house.gov/",20515,,,"La Cámara de Representantes es parte del poder legislativo del Gobierno federal. Hay 435 representantes que sirven por un período de dos años. El número de representantes por cada estado se basa en la población de ese estado. Los proyectos de ley se originan en la Cámara de Representantes pero necesitan ser aprobados con la mayoría de votos, es decir,  2/3 (dos tercios) del Senado para llegar a ser ley.","<a href=""/agencies/u-s-house-of-representatives"" hreflang=""en"">U.S. House of Representatives</a>",Yes,On,"Fri, 10/13/2023 - 13:04
"
Español,"Centro de Información Nacional sobre Pesticidas",NPIC,Corvallis,"Contacte al Centro de Información Nacional sobre Pesticidas
  http://npic.orst.edu/contactus.es.html",npic@ace.orst.edu,"(National Pesticide Information Center - NPIC)",,None,OR,"National Pesticide Information Center","333 Weniger Hall",,,1-800-858-7378,,"Centro de Información Nacional sobre Pesticidas (NPIC, sigla en inglés)
  http://www.npic.orst.edu/index.es.html",97331-6502,,,"El Centro de Nacional de Información sobre Pesticidas (NPIC, sigla en inglés) ofrece recomendaciones generales de primeros auxilios. En caso de una emergencia por envenenamiento con pesticidas llame al 911.","<a href=""/agencies/national-pesticide-information-center"" hreflang=""en"">National Pesticide Information Center</a>",Yes,On,"Mon, 03/11/2024 - 10:24
"
Español,"Centro de Información y Recursos para Padres",CPIR,Newark,"Contacte al Centro de Información y Recursos para Padres (en inglés)
  https://www.parentcenterhub.org/contact-us/",,"Center for Parent Information and Resources (CPIR)",,Quasi-official,NJ,"Center for Parent Information and Resources","c/o Statewide Parent Advocacy Network (SPAN)","507 Broad Street, Suite 702","1-973-642-8100 (en inglés)",,,"Centro de Información y Recursos para Padres (CPIR, sigla en inglés)
  https://www.parentcenterhub.org/recursos-en-espanol/",07102,,,"El Centro de Información y Recursos para Padres (CPIR, sigla en inglés) ofrece información sobre las discapacidades de infantes, niños pre-escolares, estudiantes, y jóvenes adultos, así como información sobre la Ley Educativa para Personas con Discapacidades (IDEA, sigla en inglés).","<a href=""/agencies/center-for-parent-information-and-resources"" hreflang=""en"">Center for Parent Information and Resources</a>",Yes,On,"Fri, 02/09/2024 - 10:19
"
Español,"Centro de Políticas y Promoción de la Nutrición",CNPP,Alexandria,,,"(Center for Nutrition Policy and Promotion)",,None,VA,"Food &amp; Nutrition Service","Braddock Metro Center II","1320 Braddock Place","1-703-305-2062 (en inglés)",,,"Página en inglés del Centro de Políticas y Promoción de la Nutrición (CNPP, sigla en inglés) 
  https://www.fns.usda.gov/cnpp, Crea un plato saludable en cada comida (en inglés)
  https://www.myplate.gov/",22314,,,"El Centro de Políticas y Promoción de la Nutrición (CNPP, sigla en inglés) trabaja para mejorar la salud y el bienestar del público a través del desarrollo y promoción de una guía alimentaria que vincula la investigación científica con las necesidades de los consumidores.","<a href=""/agencies/center-for-nutrition-policy-and-promotion"" hreflang=""en"">Center for Nutrition Policy and Promotion</a>",Yes,On,"Mon, 07/31/2023 - 12:16
"
Español,"Centro de Visitantes del Capitolio de EE. UU.",,Washington,"Contacte al Centro de Visitantes del Capitolio de EE. UU. (seleccione Spanish en la esquina superior derecha)
  https://www.visitthecapitol.gov/contact-us",,,,,DC,"U.S. Capitol Visitor Center",,,1-202-226-8000,,,"Centro de Visitantes del Capitolio de EE. UU. (seleccione Spanish en la esquina superior derecha) 
  https://www.visitthecapitol.gov/",20510,,,"Reserve una excursión del Centro de Visitantes del Capitolio de Estados Unidos y obtenga información de los próximos eventos. ","<a href=""/agencies/u-s-capitol-visitor-center"" hreflang=""en"">U.S. Capitol Visitor Center</a>",Yes,On,"Thu, 05/02/2024 - 10:31
"
Español,"Centro Nacional de Información de Salud",NHIC,Rockville,"Contacte al Centro Nacional de Información de Salud (en inglés)
  https://health.gov/about-odphp/contact-us",,(Healthfinder),,None,MD,"Office of the Assistant Secretary for Health, Office of the Secretary","U.S. Department of Health and Human Services","1101 Wootton Parkway, Suite 420",1-301-565-4167,1-800-336-4797,,"Página en inglés del Centro Nacional de Información de Salud (NHIC, sigla en inglés)
  https://health.gov/our-work/national-health-initiatives/health-literacy/resources/national-health-information-center",20852,,,"El Centro Nacional de Información de Salud (NHIC, sigla en inglés) ofrece gratis información acerca de enfermedades y procedimientos médicos.","<a href=""/agencies/national-health-information-center"" hreflang=""en"">National Health Information Center</a>",Yes,On,"Wed, 03/06/2024 - 09:58
"
Español,"Centro Nacional de Salud Complementaria e Integral",NCCIH,Bethesda,"Contacte al Centro Nacional de Salud Complementaria e Integral
  https://www.nccih.nih.gov/health/espanol/centro-de-informacion-del-nccih",,,,,MD,"National Center for Complementary and Integrative Health","9000 Rockville Pike",,," 1-888-644-6226",,"Centro Nacional de Salud Complementaria e Integral (NCCIH, sigla en inglés)
  https://www.nccih.nih.gov/health/espanol",20892,,,"El Centro Nacional de Salud Complementaria e Integral (NCCIH, sigla en inglés) es la agencia líder del Gobierno federal para la investigación científica enfocada en la salud complementaria e integral. Es 1 de 27 institutos, centros y oficinas que conforman los Institutos Nacionales de Salud (NIH, sigla en inglés) dentro del Departamento de Salud y Servicios Humanos de EE. UU.","<a href=""/agencies/national-center-for-complementary-and-integrative-health"" hreflang=""en"">National Center for Complementary and Integrative Health</a>",Yes,On,"Wed, 05/01/2024 - 13:50
"
Español,"Centros de Servicios de Medicare y Medicaid",CMS,Baltimore,,,"(Centers for Medicare and Medicaid Services)",,None,MD,"Centers for Medicare &amp; Medicaid Services","7500 Security Boulevard",,,"1-800-633-4227 (para español presione el 2)",,"Página en inglés de los Centros de Servicios de Medicare y Medicaid (CMS, sigla en inglés)
  https://www.cms.gov, Recursos en español
  https://www.cms.gov/about-cms/agency-information/omh/es/recursos-en-espanol",21244,,,"Los Centros de Servicios de Medicare y Medicaid (CMS, sigla en inglés) informan sobre elegibilidad e inscripción en Medicare y Medicaid, los diferentes planes de Medicare y Medicaid, y el procedimiento para presentar una reclamación. Medicare es un programa de seguro para personas de la tercera edad y personas discapacitadas. Medicaid es un programa de asistencia para personas de bajos ingresos.","<a href=""/agencies/centers-for-medicare-and-medicaid-services"" hreflang=""en"">Centers for Medicare and Medicaid Services</a>",Yes,On,"Fri, 07/14/2023 - 14:39
"
Español,"Centros para el Control y la Prevención de Enfermedades (CDC)",,Atlanta,,,"(Centers for Disease Control and Prevention &amp;#8211; CDC)",,None,GA,"CDC en Español","1600 Clifton Road",,,"1-800-232-4636 (para español presione el 2)",,"Centros para el Control y la Prevención de Enfermedades (CDC, sigla en inglés)
  https://www.cdc.gov/spanish/",30333,,,"Los Centros para el Control y la Prevención de Enfermedades (CDC, sigla en inglés) monitorean la salud pública y desarrollan estrategias para la prevención y control de las enfermedades.","<a href=""/agencies/centers-for-disease-control-and-prevention"" hreflang=""en"">Centers for Disease Control and Prevention</a>",Yes,On,"Wed, 07/19/2023 - 14:54
"
Español,"Comisión de Asistencia Electoral de EE.UU.",EAC,Washington,,,"United States Electoral Assistance Commission",,None,DC,"633 3rd Street N.W.","Suite 200",,,1-866-747-1471,,"Comisión de Asistencia Electoral de EE.UU. (EAC, sigla en inglés)
  https://www.eac.gov/translations/spanish",20001,,,"La Comisión de Asistencia Electoral de EE.UU. (EAC, sigla en inglés) desarrolla guías de votación voluntaria y ofrece información sobre la administración de las elecciones electorales. La Comisión también certifica los sistemas de votaciones y actúa como auditor de los fondos del Acta de Ayuda a América para Votar de 2002.","<a href=""/agencies/u-s-election-assistance-commission"" hreflang=""en"">U.S. Election Assistance Commission</a>",Yes,On,"Thu, 07/20/2023 - 13:27
"
Español,"Comisión de Bolsa y Valores",SEC,Washington,,help@sec.gov,"(Securities and Exchange Commission &amp;#8211; SEC)",,None,DC,"SEC Headquarters","100 F Street, NE",,,"1-800-732-0330 ",,"Comisión de Bolsa y Valores (SEC, sigla en inglés)
  http://www.sec.gov/investor/espanol.shtml",20549,,,"La Comisión de Bolsa y Valores (SEC, sigla en inglés) protege a los inversionistas y mantiene la integridad de los mercados de valores. Asimismo, combate el fraude en el sector de la inversión en valores para asegurar que los mercados de valores sean justos.","<a href=""/agencies/securities-and-exchange-commission"" hreflang=""en"">Securities and Exchange Commission</a>",Yes,On,"Mon, 07/31/2023 - 10:33
"
Español,"Comisión de Derechos Civiles de Estados Unidos",USCCR,Washington,,,"(U.S. Civil Rights Commission)",,None,DC,"1331 Pennsylvania Ave., NW, Suite 1150",,,"1-202-376-7700 (en inglés)",,,"Página en inglés de la Comisión de Derechos Civiles de Estados Unidos (USCCR, sigla en inglés)
  https://www.usccr.gov/",20425,,,"La Comisión de Derechos Civiles (USCCR, sigla en inglés) es una agencia gubernamental independiente responsable de investigar quejas de fraude en asuntos que priven a un ciudadano de sus derechos por razones de raza, religión, sexo o por su país de origen.","<a href=""/agencies/commission-on-civil-rights"" hreflang=""en"">Commission on Civil Rights</a>",Yes,On,"Mon, 02/12/2024 - 10:22
"
Español,"Comisión de Elecciones Federales",FEC,Washington,,,"(Federal Election Commission &amp;amp;ndash; FEC)",,None,DC,"Federal Election Commission","1050 First Street, NE",,,"1-800-424-9530 (en inglés)",,"Página en inglés de la Comisión de Elecciones Federales (FEC, sigla en inglés)
  https://www.fec.gov",20463,,,"La Comisión de Elecciones Federales (FEC, sigla en inglés) es una entidad normativa independiente encargada de administrar y aplicar la ley federal sobre el financiamiento de campañas. La FEC tiene jurisdicción sobre el financiamiento de las campañas de candidatos a la Cámara de Representantes, el Senado, la Presidencia y la Vicepresidencia de Estados Unidos.","<a href=""/agencies/federal-election-commission"" hreflang=""en"">Federal Election Commission</a>",Yes,On,"Fri, 07/21/2023 - 13:33
"
Español,"Comisión de Negociación de Futuros de Productos Básicos de Estados Unidos",CFTC,Washington,,,"(Commodity Futures Trading Commission - CFTC)",,None,DC,"Commodity Futures Trading Comission (CFTC)","1155 21st Street, NW",,"1-202-418-5000 (en inglés)",,,"Página en inglés de la Comisión de Negociación de Futuros de Productos Básicos de Estados Unidos (CFTC, sigla en inglés)
  https://www.cftc.gov/",20581,,,"La Comisión de Negociación de Futuros de Productos Básicos de Estados Unidos (CFTC, sigla en inglés) es una agencia independiente creada para regular los mercados de opciones en Estados Unidos.","<a href=""/agencies/u-s-commodity-futures-trading-commission"" hreflang=""en"">U.S. Commodity Futures Trading Commission</a>",Yes,On,"Fri, 07/21/2023 - 11:54
"
Español,"Comisión de Seguridad de Productos del Consumidor de Estados Unidos",CPSC,Bethesda,"Contacte a la Comisión de Seguridad de Productos del Consumidor de EE. UU. (en inglés) 
  https://www.cpsc.gov/About-CPSC/Contact-Information/Contact-Specific-Offices-and-Public-Information",,"(Consumer Product Safety Commission &amp;#8211; CPSC)",,None,MD,"U.S. Consumer Product Safety Commission","4330 East West Highway",,,"1-800-638-2772 (para español presione el 2)",,"Comisión de Seguridad de Productos del Consumidor de Estados Unidos (CPSC, sigla en inglés) 
  https://www.cpsc.gov/es/SeguridadConsumidor",20814,,,"La Comisión de Seguridad de Productos del Consumidor de Estados Unidos (CPSC, sigla en inglés) establece los criterios de seguridad para los productos de consumo y administra el retiro del mercado de productos peligrosos.","<a href=""/agencies/consumer-product-safety-commission"" hreflang=""en"">Consumer Product Safety Commission</a>",Yes,On,"Fri, 10/13/2023 - 10:33
"
Español,"Comisión Federal de Comercio",FTC,Washington,"Contacte a la Comisión Federal de Comercio
  https://www.ftc.gov/es/acerca-de-la-ftc/cont%C3%A1ctenos",,"(Federal Trade Commission - FTC)",,"Executive Department Sub-Office/Agency/Bureau",DC,"Federal Trade Commission","600 Pennsylvania Avenue, NW",,,"1-877-382-4357 (para español presione el 2)",1-866-653-4261,"Comisión Federal de Comercio (FTC, sigla en inglés)
  https://www.ftc.gov/es",20580,,,"La Comisión Federal de Comercio (FTC, sigla en inglés) es responsable de asegurar que el mercado de consumo sea eficiente y no tenga restricciones. La Comisión hace cumplir las leyes federales de protección a los consumidores y las leyes de antimonopolio y competencia.","<a href=""/agencies/federal-trade-commission"" hreflang=""en"">Federal Trade Commission</a>",Yes,On,"Thu, 07/25/2024 - 14:05
"
Español,"Comisión Federal de Comunicaciones",FCC,Washington,"Contacte a la Comisión Federal de Comunicaciones (en inglés)
  https://www.fcc.gov/about/contact, Presente una queja ante la Comisión Federal de Comunicaciones (en inglés)
  https://consumercomplaints.fcc.gov/hc/en-us",,"(Federal Communications Commission &amp;#8211; FCC)",,"Executive Department Sub-Office/Agency/Bureau",DC,"Federal Communications Commission","45 L Street NE",,,"1-888-225-5322 (para español presione el 2)",,"Comisión Federal de Comunicaciones (FCC, sigla en inglés) 
  https://www.fcc.gov/espanol",20554,,,"La Comisión Federal de Comunicaciones (FCC, sigla en inglés) es una agencia gubernamental independiente que regula las comunicaciones por radio, televisión, teléfono, satélite y cable.","<a href=""/agencies/federal-communications-commission"" hreflang=""en"">Federal Communications Commission</a>",Yes,On,"Wed, 02/21/2024 - 09:04
"
Español,"Comisión para la Igualdad de Oportunidades en el Empleo",EEOC,Washington,,,"(Equal Employment Opportunity Commission - EEOC)",,"Executive Department Sub-Office/Agency/Bureau",DC,"U.S. Equal Employment Opportunity Commission","131 M Street, NE",,,"1-800-669-4000 (para español presione el 2)",1-800-669-6820,"Comisión para la Igualdad de Oportunidades en el Empleo (EEOC, sigla en inglés)
  https://www.eeoc.gov/es",20507,,,"La Comisión para la Igualdad de Oportunidades en el Empleo (EEOC, sigla en inglés) hace cumplir la Ley de Derechos Civiles, la Ley contra la Discriminación por Edad en el Empleo, la Ley de Igualdad de Salario, la Ley de Americanos con Discapacidades y la Ley de Rehabilitación para la discriminación en el empleo.","<a href=""/agencies/equal-employment-opportunity-commission"" hreflang=""en"">Equal Employment Opportunity Commission</a>",Yes,On,"Mon, 07/31/2023 - 12:21
"
Español,"Comité Especial del Senado de EE. UU. para la Vejez",,Washington,,,"(U.S. Senate Special Committee on Aging)",,None,DC,"The United States Senate Special Committee On Aging","G16 Dirksen Senate Office Building ",,1-202-224-5364,,,"Comité Especial del Senado de EE. UU. para la Vejez (en inglés)
  https://www.aging.senate.gov/",20510,,,"El Comité Especial del Senado de EE. UU. para la Vejez participa en los debates sobre temas relacionados con los ancianos, presenta recomendaciones para futura legislación en el Senado y publica materiales que ayudan a los interesados en las políticas públicas relacionadas con este grupo. Los comités especiales estudian problemas, vigilan el desarrollo de programas e investigan informes de fraude y abuso, pero sin autoridad legislativa.",,Yes,On,"Fri, 06/30/2023 - 10:58
"
Español,"Consejo de Accesibilidad de Servicios Públicos de Estados Unidos",,Washington,,espanol@access-board.gov,"(United States Access Board)",,None,DC,"United States Access Board","1331 F Street NW, Suite 1000",,1-202-272-0050,,"1- 202-272-0066","Consejo de Accesibilidad de Servicios Públicos de Estados Unidos
  https://www.access-board.gov/es/",20004-1111,,,"El Consejo de Accesibilidad de Servicios Públicos de Estados Unidos es una agencia independiente que busca proveer acceso a personas con discapacidades a instalaciones financiadas por el gobierno Federal. El Consejo coordina entre varias agencias federales y representa directamente al público, en especial las personas con discapacidades.","<a href=""/agencies/u-s-access-board"" hreflang=""en"">U.S. Access Board</a>",Yes,On,"Thu, 07/06/2023 - 11:13
"
